|NDB_No|FdGrp_Cd|Long_Desc|FE
290|2042|200|Spices, thyme, dried (Thymus vulgaris)|123.6
252|2003|200|Spices, basil, dried (Ocimum basilicum)|89.8
307|2066|200|Spearmint, dried|87.47
272|2023|200|Spices, marjoram, dried (Origanum majorana)|82.71
8291|35009|3500|Whale, beluga, meat, dried (Alaska Native) (Delphinapterus leucas)|72.35
1983|8504|800|Cereals ready-to-eat, RALSTON Enriched Wheat Bran flakes|67.67
452|3193|300|Babyfood, cereal, oatmeal, with honey, dry|67.23
8215|31019|1100|Seaweed, Canadian Cultivated EMI-TSUNOMATA, dry (Chondrus crispus)|66.38
263|2014|200|Spices, cumin seed (Cuminum cyminum)|66.36
448|3189|300|Babyfood, cereal, oatmeal, dry fortified|64.07
1790|8028|800|Cereals ready-to-eat, KELLOGG, KELLOGG'S ALL-BRAN COMPLETE Wheat Flakes|62.1
1821|8077|800|Cereals ready-to-eat, GENERAL MILLS, Whole Grain TOTAL|60.0
1808|8058|800|Cereals ready-to-eat, KELLOGG, KELLOGG'S PRODUCT 19|60.0
291|2043|200|Spices, turmeric, ground (Curcuma longa L.)|55.0
3282|11625|1100|Parsley, freeze-dried|53.9
453|3194|300|Babyfood, cereal, rice, dry fortified|53.01
8326|35055|3500|Seal, bearded (Oogruk), meat, dried (Alaska Native)|49.6
1962|8451|800|Cereals, QUAKER, Quick Oats with Iron, Dry|49.45
266|2017|200|Spices, dill weed, dried (Anethum graveolens)|48.78
8624|42285|300|Babyfood, cereal, brown rice, dry, instant|47.6
442|3181|300|Babyfood, cereal, barley, dry fortified|47.5
463|3212|300|Babyfood, cereal, rice, with bananas, dry|47.5
445|3186|300|Babyfood, cereal, mixed, with bananas, dry|47.5
449|3190|300|Babyfood, cereal, oatmeal, with bananas, dry|47.5
462|3211|300|Babyfood, cereal, high protein, with apple and orange, dry|47.5
444|3185|300|Babyfood, cereal, mixed, dry fortified|47.5
443|3184|300|Babyfood, cereal, whole wheat, with apples, dry fortified|45.0
256|2007|200|Spices, celery seed (Apium graveolens)|44.9
3794|13333|1300|Beef, variety meats and by-products, spleen, raw|44.55
8346|35079|3500|Walrus, meat, dried (Alaska Native) (Odohenus rosmarus)|43.0
253|2004|200|Spices, bay leaf (Laurus nobilis)|43.0
1875|8177|800|Cereals, MALT-O-MEAL, chocolate, dry|42.88
261|2012|200|Spices, coriander leaf, dried (Coriandrum sativum)|42.46
1959|8444|800|Cereals, QUAKER, Instant Grits, Redeye Gravy & Country Ham flavor, dry|42.03
5312|17214|1700|Lamb, variety meats and by-products, spleen, raw|41.89
2082|8675|800|Cereals ready-to-eat, MALT-O-MEAL, OAT BLENDERS with honey & almonds|41.38
1975|8488|800|Cereals, MALT-O-MEAL, Farina Hot Wheat Cereal, dry|40.93
3795|13334|1300|Beef, variety meats and by-products, spleen, cooked, braised|39.36
1832|8092|800|Cereals, QUAKER, corn grits, instant, plain, dry|38.75
5313|17215|1700|Lamb, variety meats and by-products, spleen, cooked, braised|38.67
1984|8505|800|Cereals ready-to-eat, RALSTON Corn Biscuits|38.37
2057|8643|800|Cereals ready-to-eat, GENERAL MILLS, Honey KIX|38.2
1961|8450|800|Cereals, QUAKER, Instant Grits, Ham 'n' Cheese flavor, dry|38.2
288|2039|200|Spices, savory, ground (Satureja hortensis)|37.88
8752|43529|300|Babyfood, rice and apples, dry|37.0
251|2002|200|Spices, anise seed (Pimpinella anisum)|36.96
276|2027|200|Spices, oregano, dried (Origanum vulgare)|36.8
6199|19171|1900|Cocoa, dry powder, unsweetened, HERSHEY'S European Style Cocoa|36.0
1927|8318|800|Cereals ready-to-eat, KELLOGG, KELLOGG'S SMART START Strong Heart Antioxidants Cereal|36.0
283|2034|200|Spices, poultry seasoning|35.3
8763|43570|800|Cereals ready-to-eat, POST, HONEY BUNCHES OF OATS, honey roasted|34.82
1974|8487|800|Cereals ready-to-eat, MALT-O-MEAL, Blueberry MUFFIN TOPS Cereal|34.29
1987|8508|800|Cereals ready-to-eat, USDA Commodity Corn and Rice (includes all commodity brands)|34.06
1904|8247|800|Cereals ready-to-eat, GENERAL MILLS, TOTAL Raisin Bran|34.0
1972|8481|800|Cereals ready-to-eat, MALT-O-MEAL, HONEY GRAHAM SQUARES|33.81
8608|42240|800|Cereals ready-to-eat, POST, HONEY BUNCHES OF OATS, with almonds|33.8
268|2019|200|Spices, fenugreek seed (Trigonella foenum-graecum)|33.53
1840|8104|800|Cereals, farina, enriched, assorted brands including CREAM OF WHEAT, quick (1-3 minutes), dry|33.39
1829|8089|800|Cereals ready-to-eat, GENERAL MILLS, WHEATIES|33.3
2078|8671|800|Cereals ready-to-eat, GENERAL MILLS, Dulce De Leche CHEERIOS|33.29
1812|8064|800|Cereals ready-to-eat, GENERAL MILLS, Rice CHEX|33.29
1781|8013|800|Cereals ready-to-eat, GENERAL MILLS, CHEERIOS|33.17
8403|35175|3500|Seal, bearded (Oogruk), meat, partially dried (Alaska Native)|33.0
1789|8025|800|Cereals ready-to-eat, RALSTON CRISP RICE|32.73
289|2041|200|Spices, tarragon, dried (Artemisia dracunculus)|32.3
1820|8074|800|Cereals ready-to-eat, RALSTON TASTEEOS|32.14
2092|8685|800|Cereals ready-to-eat, QUAKER WHOLE HEARTS oat cereal|32.11
2012|8573|800|Cereals, CREAM OF WHEAT, 2 1/2 minute cook time, dry|32.02
1803|8048|800|Cereals ready-to-eat, GENERAL MILLS, KIX|32.0
257|2008|200|Spices, chervil, dried (Anthriscus cerefolium)|31.95
1865|8157|800|Cereals ready-to-eat, wheat, puffed, fortified|31.7
1864|8156|800|Cereals ready-to-eat, rice, puffed, fortified|31.7
1976|8489|800|Cereals, MALT-O-MEAL, Maple & Brown Sugar Hot Wheat Cereal, dry|31.29
2034|8598|800|Cereals ready-to-eat, GENERAL MILLS, FIBER ONE, HONEY CLUSTERS|31.2
1970|8476|800|Cereals ready-to-eat, MALT-O-MEAL, Honey BUZZERS|31.03
1785|8018|800|Cereals ready-to-eat, QUAKER, QUAKER CRUNCHY BRAN|30.98
1845|8116|800|Cereals, MALT-O-MEAL, original, plain, dry|30.86
1824|8082|800|Cereals ready-to-eat, GENERAL MILLS, Wheat CHEX|30.6
965|5143|500|Duck, domesticated, liver, raw|30.53
972|5150|500|Goose, liver, raw|30.53
1813|8065|800|Cereals ready-to-eat, KELLOGG, KELLOGG'S RICE KRISPIES|30.42
1960|8449|800|Cereals, QUAKER, Instant Grits Product with American Cheese Flavor, dry|30.38
1835|8096|800|Cereals, QUAKER, Instant Grits, Country Bacon flavor, dry|30.38
1834|8094|800|Cereals, QUAKER, corn grits, instant, cheddar cheese flavor, dry|30.38
1856|8138|800|Cereals ready-to-eat, MALT-O-MEAL, MARSHMALLOW MATEYS|30.0
2020|8582|800|Cereals ready-to-eat, GENERAL MILLS, DORA THE EXPLORER|30.0
2063|8653|800|Cereals ready-to-eat, KELLOGG'S RICE KRISPIES, Gluten Free|30.0
1894|8221|800|Cereals, QUAKER, Instant Grits, Butter flavor, dry|30.0
2083|8676|800|Cereals ready-to-eat, MALT-O-MEAL, Honey Nut SCOOTERS|30.0
1979|8494|800|Cereals ready-to-eat, MALT-O-MEAL, CINNAMON TOASTERS|30.0
1928|8319|800|Cereals ready-to-eat, KELLOGG, KELLOGG'S FROSTED MINI-WHEATS, bite size|30.0
1929|8346|800|Cereals ready-to-eat, MALT-O-MEAL, COLOSSAL CRUNCH|30.0
1775|8002|800|Cereals ready-to-eat, POST, ALPHA-BITS|30.0
1930|8347|800|Cereals ready-to-eat, MALT-O-MEAL, BERRY COLOSSAL CRUNCH|30.0
1886|8206|800|Cereals ready-to-eat, MALT-O-MEAL, COCO-ROOS|30.0
1891|8216|800|Cereals ready-to-eat, QUAKER, Toasted Multigrain Crisps|29.9
2015|8576|800|Cereals, CREAM OF WHEAT, 1 minute cook time, dry|29.75
2001|8549|800|Cereals ready-to-eat, QUAKER, QUAKER Honey Graham LIFE Cereal|29.73
1890|8215|800|Cereals ready-to-eat, QUAKER, Oatmeal Squares, cinnamon|29.5
1945|8384|800|Cereals ready-to-eat, KELLOGG, KELLOGG'S MINI-WHEATS, unfrosted bite size|29.5
2114|8708|800|Cereals ready-to-eat, KELLOGG's FROSTED MINI-WHEATS Touch of Fruit in the Middle, raisin|29.5
1997|8542|800|Cereals ready-to-eat, KELLOGG'S, FROSTED MINI-WHEATS Bite Size Strawberry Delight|29.5
1965|8459|800|Cereals ready-to-eat, KELLOGG'S, FROSTED MINI-WHEATS, Maple & Brown Sugar, Bite Size|29.5
2042|8617|800|Cereals ready-to-eat, KELLOGG's FROSTED MINI-WHEATS Bite Size Blueberry Muffin|29.5
2084|8677|800|Cereals ready-to-eat, KELLOGG'S FROSTED MINI-WHEATS Touch of Fruit in the Middle, Raspberry|29.5
1981|8500|800|Cereals ready-to-eat, MALT-O-MEAL, Frosted Mini SPOONERS|29.45
2080|8673|800|Cereals, ready-to-eat, MALT-O-MEAL, Blueberry Mini SPOONERS|29.45
1804|8049|800|Cereals ready-to-eat, QUAKER, QUAKER OAT LIFE, plain|29.33
1889|8214|800|Cereals ready-to-eat, QUAKER, Oatmeal Squares|29.3
285|2036|200|Spices, rosemary, dried (Rosmarinus officinalis)|29.25
1802|8047|800|Cereals ready-to-eat, QUAKER, KING VITAMAN|29.0
2085|8678|800|Cereals ready-to-eat, GENERAL MILLS, Apple Cinnamon CHEX|29.0
2048|8632|800|Cereals ready-to-eat, QUAKER Oatmeal Squares, Golden Maple|29.0
2107|8701|800|Cereals ready-to-eat, KELLOGG, KELLOGG'S SPECIAL K Multi-grain|29.0
2049|8633|800|Cereals ready-to-eat, POST, HONEY BUNCHES OF OATS with vanilla bunches|28.9
1787|8020|800|Cereals ready-to-eat, KELLOGG, KELLOGG'S Corn Flakes|28.9
2047|8631|800|Cereals ready-to-eat, KELLOGG'S FROSTED MINI-WHEATS LITTLE BITES, chocolate|28.89
2089|8682|800|Cereals ready-to-eat, GENERAL MILLS, Multi Grain CHEERIOS, Peanut Butter|28.89
2102|8695|800|Cereals ready-to-eat, KELLOGG, KELLOGG'S FROSTED MINI-WHEATS, little bites|28.89
2033|8596|800|Cereals ready-to-eat, GENERAL MILLS, FIBER ONE, Caramel Delight|28.79
2045|8628|800|Cereals ready-to-eat, QUAKER, Maple Brown Sugar LIFE Cereal|28.69
1842|8106|800|Cereals, CREAM OF WHEAT, instant, dry|28.6
1838|8102|800|Cereals, CREAM OF WHEAT, regular, 10 minute cooking, dry|28.6
3305|11667|1100|Seaweed, spirulina, dried|28.5
1836|8100|800|Cereals, CREAM OF RICE, dry|28.44
629|3996|300|Babyfood, Multigrain whole grain cereal, dry fortified|28.13
287|2038|200|Spices, sage, ground (Salvia officinalis)|28.12
1932|8349|800|Cereals ready-to-eat, MALT-O-MEAL, TOOTIE FRUITIES|28.12
2112|8706|800|Cereals ready-to-eat, KELLOGG SCOOBY-DOO! cereal|28.1
1823|8081|800|Cereals ready-to-eat, POST, Honey Nut Shredded Wheat|28.0
1793|8031|800|Cereals ready-to-eat, KELLOGG'S FROSTED MINI-WHEATS, Big Bite|28.0
1791|8029|800|Cereals ready-to-eat, POST Bran Flakes|28.0
8629|42297|800|Cereals ready-to-eat, POST GREAT GRAINS Banana Nut Crunch|28.0
1798|8038|800|Cereals ready-to-eat, POST, GRAPE-NUTS Cereal|28.0
1815|8067|800|Cereals ready-to-eat, KELLOGG, KELLOGG'S SPECIAL K|28.0
2073|8665|800|Cereals ready-to-eat, POST HONEY BUNCHES OF OATS with cinnamon bunches|28.0
1907|8259|800|Cereals ready-to-eat, KELLOGG, KELLOGG'S CRISPIX|28.0
1986|8507|800|Cereals ready-to-eat, RALSTON Crispy Hexagons|27.93
2040|8613|800|Cereals ready-to-eat, KELLOGG'S SPECIAL K Multigrain Oats and Honey|27.9
1799|8039|800|Cereals ready-to-eat, POST, GRAPE-NUTS Flakes|27.9
1964|8453|800|Cereals ready-to-eat, KELLOGG, KELLOGG'S SPECIAL K Chocolatey Strawberry|27.89
1828|8087|800|Cereals ready-to-eat, GENERAL MILLS, Multi-Grain CHEERIOS|27.89
1978|8493|800|Cereals ready-to-eat, MALT-O-MEAL, Apple ZINGS|27.27
1931|8348|800|Cereals ready-to-eat, MALT-O-MEAL, Crispy Rice|27.27
2037|8603|800|Cereals ready-to-eat, KELLOGG, KELLOGG'S SPECIAL K Blueberry|27.0
2032|8595|800|Cereals ready-to-eat, GENERAL MILLS, Cinnamon CHEX|27.0
2081|8674|800|Cereals ready-to-eat, MALT-O-MEAL, OAT BLENDERS with honey|27.0
1998|8543|800|Cereals ready-to-eat, KELLOGG'S, SPECIAL K Vanilla Almond|27.0
2036|8602|800|Cereals ready-to-eat, KELLOGG, KELLOGG'S SPECIAL K, Cinnamon Pecan|27.0
1817|8069|800|Cereals ready-to-eat, KELLOGG, KELLOGG'S FROSTED FLAKES|26.7
1786|8019|800|Cereals ready-to-eat, GENERAL MILLS, Corn CHEX|26.1
1944|8383|800|Cereals ready-to-eat, KELLOGG, KELLOGG'S SPECIAL K Red Berries|26.1
2071|8662|800|Cereals ready-to-eat, POST, HONEY BUNCHES OF OATS, with real strawberries|26.1
2022|8584|800|Cereals ready-to-eat, KELLOGG'S SPECIAL K Chocolatey Delight|26.1
2117|8711|800|Cereals ready-to-eat, KELLOGG'S, SPECIAL K protein, cinnamon brown sugar crunch|26.1
8293|35011|3500|Whale, beluga, meat, raw (Alaska Native) (Delphinapterus leucas)|25.9
2113|8707|800|Cereals ready-to-eat, KELLOGG'S SPECIAL K Chocolate Almond|25.7
2031|8594|800|Cereals ready-to-eat, GENERAL MILLS, Chocolate CHEX|25.7
1969|8471|800|Cereals ready-to-eat, KELLOGG'S, SPECIAL K Protein Plus|25.3
1993|8531|800|Cereals ready-to-eat, KELLOGG, SPECIAL K, Fruit & Yogurt|25.3
2074|8666|800|Cereals ready-to-eat, GENERAL MILLS, Cinnamon Burst CHEERIOS|25.29
4160|14055|1400|Beverages, UNILEVER, SLIMFAST Shake Mix, high protein, whey powder, 3-2-1 Plan,|24.84
333|3023|300|Finger snacks, GERBER GRADUATE PUFFS, apple and cinnamon|24.74
1848|8122|800|Cereals, oats, instant, fortified, plain, dry|24.72
2008|8567|800|Cereals ready-to-eat, KASHI 7 Whole Grain Nuggets|24.0
2079|8672|800|Cereals ready-to-eat, MALT-O-MEAL, CHOCOLATE MARSHMALLOW MATEYS|24.0
1917|8274|800|Cereals ready-to-eat, GENERAL MILLS, BERRY BERRY KIX|23.7
2583|10110|1000|Pork, fresh, variety meats and by-products, liver, raw|23.3
1887|8210|800|Cereals ready-to-eat, QUAKER, QUAKER OAT CINNAMON LIFE|23.22
4481|14654|1400|Beverages, nutritional shake mix, high protein, powder|22.5
8623|42284|300|Babyfood, baked product, finger snacks cereal fortified|22.5
2590|10117|1000|Pork, fresh, variety meats and by-products, spleen, raw|22.32
1805|8050|800|Cereals ready-to-eat, GENERAL MILLS, LUCKY CHARMS|22.27
2591|10118|1000|Pork, fresh, variety meats and by-products, spleen, cooked, braised|22.23
278|2029|200|Spices, parsley, dried (Petroselinum crispum)|22.04
2019|8580|800|Incaparina, dry mix (corn and soy flours), unprepared|22.0
2046|8629|800|Cereals ready-to-eat, QUAKER, Cap'n Crunch's OOPS! All Berries Cereal|21.57
3303|11663|1100|Seaweed, agar, dried|21.4
277|2028|200|Spices, paprika (Capsicum annuum)|21.14
8329|35058|3500|Oopah (tunicate), whole animal (Alaska Native) (Tunicata)|20.7
1800|8045|800|Cereals ready-to-eat, GENERAL MILLS, HONEY NUT CHEERIOS|20.58
1915|8272|800|Cereals ready-to-eat, GENERAL MILLS, CINNAMON TOAST CRUNCH|20.48
3273|11615|1100|Chives, freeze-dried|20.0
5024|16507|1600|LOMA LINDA Redi-Burger, canned, unprepared|20.0
1779|8011|800|Cereals ready-to-eat, QUAKER, CAP'N CRUNCH with CRUNCHBERRIES|19.8
270|2021|200|Spices, ginger, ground (Zingiber officinale)|19.8
2002|8550|800|Cereals ready-to-eat, QUAKER, Christmas Crunch|19.78
284|2035|200|Spices, pumpkin pie spice|19.71
2043|8625|800|Cereals ready-to-eat, QUAKER, CAP'N CRUNCH'S Halloween Crunch|19.6
8340|35071|3500|Seal, ringed, meat (Alaska Native) (Pusa hispida)|19.6
1888|8211|800|Cereals ready-to-eat, QUAKER, HONEY GRAHAM OH!S|19.52
1778|8010|800|Cereals ready-to-eat, QUAKER, CAP'N CRUNCH|19.42
1985|8506|800|Cereals ready-to-eat, RALSTON Corn Flakes|19.4
2023|8586|800|Cereals ready-to-eat, GENERAL MILLS, 25% Less Sugar TRIX|19.29
3697|12169|1200|Seeds, sesame butter, paste|19.2
264|2015|200|Spices, curry powder|19.1
2585|10112|1000|Pork, fresh, variety meats and by-products, lungs, raw|18.9
6523|20060|2000|Rice bran, crude|18.54
267|2018|200|Spices, fennel seed (Foeniculum vulgare)|18.54
2116|8710|800|Cereals ready-to-eat, KELLOGG'S, SPECIAL K gluten free, touch of brown sugar|18.39
1780|8012|800|Cereals ready-to-eat, QUAKER, CAP'N CRUNCH'S PEANUT BUTTER CRUNCH|18.36
1809|8059|800|Cereals ready-to-eat, QUAKER, SWEET CRUNCH/QUISP|18.35
1811|8061|800|Cereals ready-to-eat, POST Raisin Bran Cereal|18.3
7705|25008|2500|Formulated bar, MARS SNACKFOOD US, SNICKERS MARATHON Honey Nut Oat Bar|18.15
1794|8032|800|Cereals ready-to-eat, KELLOGG, KELLOGG'S FROSTED RICE KRISPIES|18.0
7703|25006|2500|Formulated bar, MARS SNACKFOOD US, SNICKERS MARATHON Double Chocolate Nut Bar|17.95
2584|10111|1000|Pork, fresh, variety meats and by-products, liver, cooked, braised|17.92
1774|8001|800|Cereals ready-to-eat, KELLOGG, KELLOGG'S ALL-BRAN Original|17.6
4882|16156|1600|Peanut butter, chunky, vitamin and mineral fortified|17.5
297|2049|200|Thyme, fresh (Thymus vulgaris)|17.45
6111|19078|1900|Baking chocolate, unsweetened, squares|17.4
258|2009|200|Spices, chili powder|17.3
1784|8017|800|Cereals ready-to-eat, GENERAL MILLS, COOKIE CRISP|17.3
8612|42261|800|Cereals ready-to-eat, POST, GREAT GRAINS Crunchy Pecan Cereal|17.3
8398|35170|3500|Seal, bearded (Oogruk), meat, low quadrant, raw (Alaska Native)|17.0
8392|35164|3500|Seal, bearded (Oogruk), meat, dried, in oil (Alaska Native)|17.0
1822|8078|800|Cereals ready-to-eat, GENERAL MILLS, TRIX|16.89
1911|8267|800|Cereals ready-to-eat, GENERAL MILLS, FROSTED CHEERIOS|16.7
2021|8583|800|Cereals ready-to-eat, GENERAL MILLS, Fruity CHEERIOS|16.7
2030|8593|800|Cereals ready-to-eat, GENERAL MILLS, CHEERIOS, Chocolate|16.7
1899|8239|800|Cereals ready-to-eat, GENERAL MILLS, Berry Burst CHEERIOS, Triple Berry|16.7
1913|8270|800|Cereals ready-to-eat, GENERAL MILLS, COUNT CHOCULA|16.7
1914|8271|800|Cereals ready-to-eat, GENERAL MILLS, COCOA PUFFS|16.7
2052|8637|800|Cereals ready-to-eat, GENERAL MILLS, Oat Cluster CHEERIOS Crunch|16.7
4881|16155|1600|Peanut butter, smooth, vitamin and mineral fortified|16.6
2586|10113|1000|Pork, fresh, variety meats and by-products, lungs, cooked, braised|16.41
8613|42265|800|Cereals ready-to-eat, POST, GREAT GRAINS, Raisin, Date & Pecan|16.4
4350|14315|1400|Beverages, OVALTINE, chocolate malt powder|16.36
4346|14309|1400|Beverages, OVALTINE, Classic Malt powder|16.36
4179|14080|1400|Beverages, rich chocolate, powder|16.36
265|2016|200|Spices, dill seed (Anethum graveolens)|16.33
262|2013|200|Spices, coriander seed (Coriandrum sativum)|16.32
7712|25016|2500|Formulated bar, MARS SNACKFOOD US, SNICKERS MARATHON Energy Bar, all flavors|16.31
254|2005|200|Spices, caraway seed (Carum carvi)|16.23
8307|35028|3500|Cockles, raw (Alaska Native) (Clinocardium nuttallii)|16.2
2070|8661|800|Cereals ready-to-eat, KELLOGG'S CINNAMON JACKS|16.1
2069|8660|800|Cereals ready-to-eat, KELLOGG'S APPLE JACKS with marshmallows|16.1
1992|8513|800|Cereals ready-to-eat, GENERAL MILLS, CHOCOLATE LUCKY CHARMS|16.1
2029|8592|800|Cereals ready-to-eat, GENERAL MILLS, CHEERIOS, Banana Nut|16.1
1776|8003|800|Cereals ready-to-eat, KELLOGG, KELLOGG'S APPLE JACKS|16.1
8305|35026|3500|Chiton, leathery, gumboots (Alaska Native) (Katharina tunicata)|16.0
1885|8204|800|Cereals ready-to-eat, chocolate-flavored frosted puffed corn|15.87
8302|35023|3500|Caribou, liver, raw (Alaska Native) (Rangifer tarandus)|15.7
4844|16108|1600|Soybeans, mature seeds, raw|15.7
2025|8588|800|Cereals ready-to-eat, KELLOGG, KELLOGG'S CINNABON cereal|15.69
6195|19166|1900|Cocoa, dry powder, unsweetened, processed with alkali|15.52
1882|8194|800|Cereals ready-to-eat, GENERAL MILLS, REESE'S PUFFS|15.5
1792|8030|800|Cereals ready-to-eat, KELLOGG, KELLOGG'S FROOT LOOPS|15.5
2064|8655|800|Cereals ready-to-eat, POST, HONEY BUNCHES OF OATS, pecan bunches|15.5
1942|8376|800|Cereals ready-to-eat, KELLOGG, KELLOGG'S MARSHMALLOW FROOT LOOPS|15.5
1973|8484|800|Cereals ready-to-eat, MALT-O-MEAL, Raisin Bran Cereal|15.25
3698|12170|1200|Seeds, sesame flour, high-fat|15.17
2076|8669|800|Cereals ready-to-eat, GENERAL MILLS, FIBER ONE 80 Calories, Chocolate Squares|15.0
1968|8469|800|Cereals ready-to-eat, KELLOGG'S, Reduced Sugar Frosted Flakes Cereal|15.0
2086|8679|800|Cereals ready-to-eat, GENERAL MILLS, FROSTED TOAST CRUNCH|15.0
2068|8659|800|Cereals ready-to-eat, KELLOGG'S FROSTED FLAKES, CHOCO ZUCARITAS|15.0
2003|8553|800|Cereals ready-to-eat, GENERAL MILLS, CHEERIOS, Yogurt Burst, strawberry|15.0
2067|8658|800|Cereals ready-to-eat, KELLOGG'S KRAVE double chocolate cereal|15.0
1884|8202|800|Cereals ready-to-eat, GENERAL MILLS, OATMEAL CRISP, Crunchy Almond|15.0
1902|8244|800|Cereals ready-to-eat, GENERAL MILLS, FIBER ONE Bran Cereal|15.0
1910|8263|800|Cereals ready-to-eat, GENERAL MILLS, APPLE CINNAMON CHEERIOS|15.0
2061|8651|800|Cereals ready-to-eat, GENERAL MILLS, FIBER ONE 80 Calories, Honey Squares|15.0
2051|8635|800|Cereals ready-to-eat, GENERAL MILLS, COCOA PUFFS, 25% Reduced Sugar|15.0
1777|8005|800|Cereals ready-to-eat, KELLOGG, KELLOGG'S ALL-BRAN BRAN BUDS|15.0
8606|42236|800|Cereals ready-to-eat, frosted oat cereal with marshmallows|15.0
3620|12024|1200|Seeds, sesame seeds, whole, roasted and toasted|14.76
5461|17364|1700|Lamb, New Zealand, imported, kidney, cooked, soaked and fried|14.7
7702|25005|2500|Formulated bar, MARS SNACKFOOD US, SNICKERS MARATHON MULTIGRAIN CRUNCH BAR|14.67
3619|12023|1200|Seeds, sesame seeds, whole, dried (Sesamum indicum)|14.55
3624|12034|1200|Seeds, sesame meal, partially defatted|14.55
2077|8670|800|Cereals ready-to-eat, GENERAL MILLS, HONEY NUT CHEERIOS, MEDLEY CRUNCH|14.5
1903|8245|800|Cereals ready-to-eat, GENERAL MILLS, OATMEAL CRISP, Hearty Raisin|14.5
6420|19859|1900|Cocoa, dry powder, hi-fat or breakfast, plain|14.5
6421|19860|1900|Cocoa, dry powder, hi-fat or breakfast, processed with alkali|14.5
2041|8615|800|Cereals ready-to-eat, KELLOGG'S CRUNCHY NUT Golden Honey Nut flakes|14.5
2050|8634|800|Cereals ready-to-eat, GENERAL MILLS, PEANUT BUTTER TOAST CRUNCH|14.5
5009|16422|1600|Soy protein isolate, potassium type|14.5
2062|8652|800|Cereals ready-to-eat, KELLOGG'S KRAVE chocolate cereal|14.5
1796|8035|800|Cereals ready-to-eat, GENERAL MILLS, GOLDEN GRAHAMS|14.5
2105|8699|800|Cereals ready-to-eat, KELLOGG'S KRAVE Smores|14.5
4858|16122|1600|Soy protein isolate|14.5
1782|8014|800|Cereals ready-to-eat, KELLOGG, KELLOGG'S COCOA KRISPIES|14.5
517|3711|300|Babyfood, cereal, high protein, with apple and orange, prepared with whole milk|14.42
8350|35083|3500|Walrus, liver, raw (Alaska Native) (Odohenus rosmarus)|14.4
281|2032|200|Spices, pepper, white (Piper nigrum)|14.31
3622|12032|1200|Seeds, sesame flour, partially defatted|14.3
459|3205|300|Babyfood, oatmeal cereal with fruit, dry, instant, toddler fortified|14.3
3623|12033|1200|Seeds, sesame flour, low-fat|14.22
7716|25021|2500|Formulated bar, LUNA BAR, NUTZ OVER CHOCOLATE|14.2
1807|8057|800|Cereals ready-to-eat, GENERAL MILLS, Honey Nut CHEX|14.1
255|2006|200|Spices, cardamom (Elettaria cardamomum)|13.97
4636|15158|1500|Mollusks, clam, mixed species, cooked, breaded and fried|13.91
271|2022|200|Spices, mace, ground (Myristica fragrans)|13.9
1938|8363|800|Cereals ready-to-eat, SUN COUNTRY, KRETSCHMER Toasted Wheat Bran|13.88
6194|19165|1900|Cocoa, dry powder, unsweetened|13.86
4855|16119|1600|Soy meal, defatted, raw|13.7
1912|8268|800|Cereals ready-to-eat, GENERAL MILLS, FRANKENBERRY|13.6
1916|8273|800|Cereals ready-to-eat, GENERAL MILLS, BOO BERRY|13.6
8341|35072|3500|Seal, ringed, liver (Alaska Native) (Pusa hispida)|13.5
4870|16135|1600|Winged beans, mature seeds, raw (Psophocarpus tetragonolobus)|13.44
3612|12011|1200|Seeds, cottonseed meal, partially defatted (glandless)|13.35
7966|28162|1800|KELLOGG'S, Corn Flakes Crumbs|13.3
608|3964|300|Babyfood, fortified cereal bar, fruit filling|13.16
8327|35056|3500|Seal, bearded (Oogruk), meat, raw (Alaska Native) (Erignathus barbatus)|12.9
2018|8579|800|Cereals ready-to-eat, GENERAL MILLS, 25% Less Sugar CINNAMON TOAST CRUNCH|12.89
1116|5661|500|Chicken, liver, all classes, cooked, pan-fried|12.88
8607|42237|800|Cereals ready-to-eat, WEETABIX whole grain cereal|12.86
8676|43205|100|Beverage, instant breakfast powder, chocolate, not reconstituted|12.82
2056|8642|800|Cereals, QUAKER, Instant Oatmeal, Apple and Cinnamon, reduced sugar|12.77
3610|12007|1200|Seeds, cottonseed flour, partially defatted (glandless)|12.66
3611|12008|1200|Seeds, cottonseed flour, low fat (glandless)|12.58
5952|18562|1800|ARCHWAY Home Style Cookies, Reduced Fat Ginger Snaps|12.57
5294|17196|1700|Lamb, variety meats and by-products, kidneys, cooked, braised|12.4
1810|8060|800|Cereals ready-to-eat, KELLOGG, KELLOGG'S RAISIN BRAN|12.33
2989|11240|1100|Mushrooms, morel, raw (Morchella spp.)|12.18
511|3689|300|Babyfood, cereal, oatmeal, prepared with whole milk|12.14
508|3682|300|Babyfood, cereal, high protein, prepared with whole milk|12.14
5679|18166|1800|Cookies, chocolate sandwich, with creme filling, regular|12.14
2055|8641|800|Cereals, QUAKER, Instant Oatmeal, fruit and cream, variety of flavors, reduced sugar|12.13
4172|14067|1400|Beverages, Protein powder soy based|12.0
2053|8639|800|Cereals, QUAKER, Instant Oatmeal, Cinnamon Spice, reduced sugar|12.0
191|1224|100|Protein supplement, milk based, Muscle Milk Light, powder|12.0
4842|16106|1600|Meat extender|11.99
6452|19904|1900|Chocolate, dark, 70-85% cacao solids|11.9
4493|15012|1500|Fish, caviar, black and red, granular|11.88
306|2065|200|Spearmint, fresh (Mentha spicata)|11.87
260|2011|200|Spices, cloves, ground (Syzygium aromaticum)|11.83
7713|25017|2500|Formulated bar, POWER BAR, chocolate|11.7
850|5028|500|Chicken, liver, all classes, cooked, simmered|11.63
1953|8409|800|Cereals ready-to-eat, MALT-O-MEAL, Frosted Flakes|11.6
8439|35229|3500|Sea lion, Steller, meat (Alaska Native) (Eumetopias jubatus)|11.48
1895|8225|800|Cereals, QUAKER, Instant Oatmeal, fruit and cream variety, dry|11.3
5855|18370|1800|Leavening agents, baking powder, double-acting, straight phosphate|11.27
516|3704|300|Babyfood, cereal, mixed, with honey, prepared with whole milk|11.27
1630|7014|700|Braunschweiger (a liver sausage), pork|11.2
286|2037|200|Spices, saffron (Crocus sativus)|11.1
513|3693|300|Babyfood, cereal, oatmeal, with honey, prepared with whole milk|11.09
5854|18369|1800|Leavening agents, baking powder, double-acting, sodium aluminum sulfate|11.02
8389|35160|3500|Caribou, rump meat, half dried (Alaska Native)|11.0
8390|35161|3500|Caribou, shoulder meat, dried (Alaska Native)|11.0
3585|11978|1100|Peppers, ancho, dried|10.93
7755|25068|2500|Snack, BALANCE, original bar|10.9
4815|16078|1600|Mothbeans, mature seeds, raw (Vigna aconitifolia)|10.85
4706|15229|1500|Mollusks, cuttlefish, mixed species, cooked, moist heat|10.84
1652|7040|700|Liver cheese, pork|10.83
515|3696|300|Babyfood, cereal, rice, with honey, prepared with whole milk|10.81
4857|16121|1600|Soy protein concentrate, produced by alcohol extraction|10.78
5008|16420|1600|Soy protein concentrate, produced by acid wash|10.78
5245|17147|1700|Game meat, bear, cooked, simmered|10.73
1896|8228|800|Cereals, QUAKER, Instant Oatmeal, raisins, dates and walnuts, dry|10.7
6540|20077|2000|Wheat bran, crude|10.57
1988|8509|800|Cereals ready-to-eat, USDA Commodity Rice Crisps (includes all commodity brands)|10.53
1693|7207|700|OSCAR MAYER, Braunschweiger Liver Sausage (sliced)|10.51
4787|16049|1600|Beans, white, mature seeds, raw (Phaseolus vulgaris)|10.44
509|3685|300|Babyfood, cereal, mixed, prepared with whole milk|10.43
3285|11634|1100|Peppers, sweet, green, freeze-dried|10.4
