|NDB_No|FdGrp_Cd|Long_Desc|FE
3337|11720|1100|Beans, pinto, immature seeds, frozen, cooked, boiled, drained, with salt|2.71
5422|17325|1700|"Lamb, Australian, imported, fresh, shoulder, arm, separable lean only,   trimmed to 1/8"" fat, cooked, braised"|2.71
7483|23405|1300|Beef, New Zealand, imported, chuck eye roll, separable lean only, cooked, braised|2.71
3855|13401|1300|"Beef, round, bottom round, steak, separable lean and fat, trimmed to 0"" fat, choice, cooked, braised"|2.71
7606|23563|1300|Beef, ground, 90% lean meat / 10% fat, patty, cooked, broiled|2.71
2851|11049|1100|Beans, pinto, immature seeds, frozen, cooked, boiled, drained, without salt|2.71
3765|13158|1300|"Beef, round, full cut, separable lean only, trimmed to 1/4"" fat, select, cooked, broiled"|2.71
6685|21089|2100|Fast foods, cheeseburger; single, regular patty; plain|2.71
5836|18349|1800|Rolls, french|2.71
6297|19310|1900|Pectin, unsweetened, dry mix|2.71
6594|20314|2000|Corn grain, white|2.71
6484|20014|2000|Corn grain, yellow (Zea mays mays L.)|2.71
6821|21296|2100|"PIZZA HUT 14"" Pepperoni Pizza, Hand-Tossed Crust"|2.71
5146|17048|1700|"Lamb, domestic, shoulder, arm, separable lean only, trimmed to 1/4"" fat, choice, cooked, braised"|2.7
7651|23608|1300|"Beef, round, top round, steak, separable lean only, trimmed to 1/8"" fat, all grades, cooked, broiled"|2.7
7888|28082|1800|KEEBLER, FUDGE SHOPPE, Peanut Creme Filled Cookies|2.7
4023|13872|1300|"Beef, round, bottom round, steak, separable lean and fat, trimmed to 1/8"" fat, choice, cooked, braised"|2.7
2007|8562|800|Cereals, KASHI GO LEAN Hot Cereal, Creamy TRULY VANILLA, dry|2.7
964|5142|500|Duck, domesticated, meat only, cooked, roasted|2.7
7868|28061|1800|KEEBLER, CHIPS DELUXE, Rainbow Chocolate Chip Cookies, bite size|2.7
8514|36403|3600|Restaurant, Latino, empanadas, beef, prepared|2.7
7215|23125|1300|"Beef, chuck, short ribs, boneless, separable lean and fat, trimmed to 0"" fat, all grades, cooked, braised"|2.7
7476|23397|1300|Beef, New Zealand, imported, bolar blade, separable lean only, cooked, fast roasted|2.7
4850|16114|1600|Tempeh|2.7
2088|8681|800|Cereals ready-to-eat, CASCADIAN FARM, Cinnamon Crunch|2.7
2090|8683|800|Cereals ready-to-eat, CASCADIAN FARM, Multi-Grain Squares|2.7
3764|13156|1300|"Beef, round, full cut, separable lean only, trimmed to 1/4"" fat, choice, cooked, broiled"|2.7
5087|16608|1600|MORNINGSTAR FARMS Chik Patties Original, frozen, unprepared|2.7
6567|20114|2000|Noodles, japanese, soba, dry|2.7
962|5140|500|Duck, domesticated, meat and skin, cooked, roasted|2.7
5592|18039|1800|Bread, oatmeal|2.7
1700|7278|700|HORMEL Pillow Pak Sliced Turkey Pepperoni|2.7
6271|19268|1900|Candies, dark chocolate coated coffee beans|2.7
8314|35041|3500|Fish, herring eggs, Pacific, plain (Alaska Native) (Clupea harengus pallasi Valenciennes)|2.7
7735|25041|2500|Snacks, granola bar, KASHI TLC Bar, crunchy, mixed flavors|2.7
6044|18996|1800|KELLOGG'S, EGGO, Biscuit Scramblers, Egg & Cheese|2.7
8016|28213|1800|MURRAY, Duplex Creme Sandwich Cookies|2.7
6043|18995|1800|KELLOGG'S, EGGO, Biscuit Scramblers, Bacon, Egg & Cheese|2.7
7828|28020|1800|KASHI, TLC, Pita Crisps, Zesty Salsa|2.7
7928|28124|1800|KEEBLER, SANDIES, Cashew Shortbread Cookies|2.7
5724|18218|1800|Crackers, matzo, egg|2.7
5862|18377|1800|Cookies, oatmeal, prepared from recipe, without raisins|2.7
314|3000|300|Clif Z bar|2.7
5833|18346|1800|Rolls, dinner, rye|2.7
7998|28195|1800|MOTHER'S, Chocolate Chip Cookies|2.7
5587|18032|1800|Bread, irish soda, prepared from recipe|2.69
1892|8218|800|Cereals ready-to-eat, QUAKER, QUAKER 100% Natural Granola with Oats, Wheat, Honey, and Raisins|2.69
2589|10116|1000|Pork, fresh, variety meats and by-products, pancreas, cooked, braised|2.69
3944|13648|1300|"Beef, shoulder pot roast or steak, boneless, separable lean only, trimmed to 0"" fat, choice, raw"|2.69
6089|19050|2500|Snacks, pretzels, hard, whole-wheat including both salted and unsalted|2.69
3822|13363|1300|"Beef, composite of trimmed retail cuts, separable lean and fat, trimmed to 0"" fat, select, cooked"|2.69
7355|23275|1300|"Beef, ribeye petite roast, boneless, separable lean only, trimmed to 0"" fat, all grades, cooked, roasted"|2.68
3837|13380|1300|"Beef, chuck, under blade pot roast, boneless, separable lean and fat, trimmed to 0"" fat, choice, cooked, braised"|2.68
6579|20130|2000|Barley flour or meal|2.68
8406|35178|3500|Elk, free range, roast, eye of round, cooked (Shoshone Bannock)|2.68
7612|23569|1300|Beef, ground, 85% lean meat / 15% fat, patty, cooked, pan-broiled|2.68
4638|15160|1500|Mollusks, clam, mixed species, canned, drained solids|2.68
8156|28355|1800|CRUNCHMASTER, Multi-Grain Crisps, Snack Crackers, Gluten-Free|2.68
7274|23184|1300|"Beef, rib, back ribs, bone-in, separable lean only, trimmed to 0"" fat, select, cooked, braised"|2.68
7189|23099|1300|"Beef, chuck, under blade pot roast, boneless, separable lean and fat, trimmed to 0"" fat, all grades, cooked, braised"|2.68
3565|11956|1100|Tomatoes, sun-dried, packed in oil, drained|2.68
3838|13381|1300|"Beef, chuck, under blade pot roast, boneless, separable lean and fat, trimmed to 0"" fat, select, cooked, braised"|2.67
7300|23220|1300|Beef, ground, unspecified fat content, cooked|2.67
7216|23126|1300|"Beef, chuck, short ribs, boneless, separable lean and fat, trimmed to 0"" fat, choice, cooked, braised"|2.67
5138|17040|1700|"Lamb, domestic, shoulder, whole (arm and blade), separable lean only, trimmed to 1/4"" fat, choice, cooked, braised"|2.67
7121|23031|1300|"Beef, round, knuckle, tip side, steak, separable lean and fat, trimmed to 0"" fat, choice, cooked, grilled"|2.67
5740|18234|1800|Crackers, wheat, sandwich, with peanut butter filling|2.67
4020|13869|1300|"Beef, round, bottom round, steak, separable lean and fat, trimmed to 1/8"" fat, all grades, cooked, braised"|2.67
8240|32007|2200|Taquitos, frozen, beef and cheese, oven-heated|2.67
6400|19806|2500|Snacks, popcorn, air-popped (Unsalted)|2.66
2150|9032|900|Apricots, dried, sulfured, uncooked|2.66
4116|13979|1300|"Beef, plate, outside skirt steak, separable lean only, trimmed to 0"" fat, all grades, cooked, broiled"|2.66
7635|23592|1300|"Beef, round, top round, steak, separable lean only, trimmed to 1/8"" fat, select, cooked, broiled"|2.66
5770|18267|1800|English muffins, whole-wheat, toasted|2.66
5012|16426|1600|Tofu, raw, firm, prepared with calcium sulfate|2.66
7370|23290|1300|"Beef, top loin petite roast/filet, boneless, separable lean and fat, trimmed to 1/8"" fat, all grades, raw"|2.66
7371|23291|1300|"Beef, top loin petite roast/filet, boneless, separable lean and fat, trimmed to 1/8"" fat, choice, raw"|2.66
7575|23506|1300|USDA Commodity, beef patties with VPP, frozen, raw|2.66
7270|23180|1300|"Beef, rib, back ribs, bone-in, separable lean only, trimmed to 0"" fat, all grades, cooked, braised"|2.66
7201|23111|1300|"Beef, shoulder pot roast or steak, boneless, separable lean and fat, trimmed to 0"" fat, choice, raw"|2.66
5434|17337|1700|"Game meat, bison, top round, separable lean only, 1"" steak, raw (Bison bison)"|2.66
3729|12632|1200|Nuts, macadamia nuts, dry roasted, with salt added|2.65
6164|19134|1900|Candies, milk chocolate, with rice cereal|2.65
5318|17220|1700|Lamb, variety meats and by-products, tongue, raw|2.65
7238|23148|1300|"Beef, rib eye steak, boneless, lip-on, separable lean only, trimmed to 1/8"" fat, choice, cooked, grilled"|2.65
7266|23176|1300|"Beef, rib eye steak, boneless, lip off, separable lean only, trimmed to 0"" fat, choice, cooked, grilled"|2.65
5845|18358|1800|Sweet rolls, cinnamon, refrigerated dough with frosting, baked|2.65
1105|5648|500|Ostrich, outside leg, raw (Struthio camelus)|2.65
7356|23276|1300|"Beef, ribeye petite roast, boneless, separable lean only, trimmed to 0"" fat, choice, cooked, roasted"|2.65
5695|18184|1800|Cookies, oatmeal, prepared from recipe, with raisins|2.65
3673|12132|1200|Nuts, macadamia nuts, dry roasted, without salt added|2.65
6097|19061|2500|Snacks, trail mix, tropical|2.64
5017|16434|1600|Yardlong beans, mature seeds, cooked, boiled, with salt|2.64
7272|23182|1300|"Beef, rib, back ribs, bone-in, separable lean only, trimmed to 0"" fat, choice, cooked, braised"|2.64
7350|23270|1300|"Beef, ribeye cap steak, boneless, separable lean only, trimmed to 0"" fat, choice, raw"|2.64
4869|16134|1600|Yardlong beans, mature seeds, cooked, boiled, without salt|2.64
7349|23269|1300|"Beef, ribeye cap steak, boneless, separable lean only, trimmed to 0"" fat, all grades, raw"|2.64
7129|23039|1300|"Beef, chuck, shoulder clod, shoulder top and center steaks, separable lean and fat, trimmed to 0"" fat, select, raw"|2.64
4026|13875|1300|"Beef, round, bottom round, steak, separable lean and fat, trimmed to 1/8"" fat, select, cooked, braised"|2.64
6713|21121|2100|Fast foods, roast beef sandwich, plain|2.64
5738|18232|1800|Crackers, wheat, regular|2.64
3943|13647|1300|"Beef, shoulder pot roast or steak, boneless, separable lean only, trimmed to 0"" fat, all grades, raw"|2.64
7004|21527|2100|ARBY'S, roast beef sandwich, classic|2.64
8139|28337|1800|Bread, gluten-free, white, made with rice flour, corn starch, and/or tapioca|2.63
6668|21022|2100|Fast foods, english muffin, with egg, cheese, and sausage|2.63
5937|18522|1800|ARCHWAY Home Style Cookies, Chocolate Chip Ice Box|2.63
1862|8147|800|Cereals ready-to-eat, POST, Shredded Wheat, original big biscuit|2.63
6525|20062|2000|Rye grain (Secale cereale L.)|2.63
7623|23580|1300|Beef, ground, 75% lean meat / 25% fat, crumbles, cooked, pan-browned|2.63
7006|21601|2100|School Lunch, pizza, cheese topping, thick crust, whole grain, frozen, cooked|2.63
1768|7973|700|Turkey bacon, microwaved|2.63
5319|17221|1700|Lamb, variety meats and by-products, tongue, cooked, braised|2.63
7248|23158|1300|"Beef, rib eye steak, bone-in, lip-on, separable lean only, trimmed to 1/8"" fat, select, cooked, grilled"|2.63
912|5090|500|Chicken, broilers or fryers, neck, meat only, cooked, simmered|2.63
5545|17448|1700|"Lamb, Australian, imported, fresh, rack, roast, frenched, bone-in, separable lean only, trimmed to 1/8"" fat, cooked, roasted"|2.63
3581|11974|1100|Grape leaves, raw (Vitis vinifera)|2.63
8097|28295|1800|Tortillas, ready-to-bake or -fry, whole wheat|2.63
7111|23000|1300|"Beef, shoulder pot roast or steak, boneless, separable lean and fat, trimmed to 0"" fat, all grades, raw"|2.62
7246|23156|1300|"Beef, rib eye steak, bone-in, lip-on, separable lean only, trimmed to 1/8"" fat, all grades, cooked, grilled"|2.62
7133|23043|1300|"Beef, chuck, shoulder clod, top blade, steak, separable lean and fat, trimmed to 0"" fat, select, raw"|2.62
5594|18041|1800|Bread, pita, white, enriched|2.62
5739|18233|1800|Crackers, wheat, sandwich, with cheese filling|2.62
6818|21293|2100|"PIZZA HUT 14"" Cheese Pizza, Hand-Tossed Crust"|2.62
3676|12137|1200|Nuts, mixed nuts, oil roasted, with peanuts, without salt added|2.61
8402|35174|3500|Buffalo, free range, top round steak, raw (Shoshone Bannock)|2.61
7663|23620|1300|"Beef, round, eye of round, roast, separable lean only, trimmed to 1/8"" fat, choice, cooked, roasted"|2.61
7473|23393|1300|"Beef, loin, top loin steak, boneless, lip-on, separable lean only, trimmed to 1/8"" fat, select, cooked, grilled"|2.61
3731|12637|1200|Nuts, mixed nuts, oil roasted, with peanuts, with salt added|2.61
3800|13340|1300|Beef, variety meats and by-products, tongue, cooked, simmered|2.61
3793|13332|1300|Beef, variety meats and by-products, pancreas, cooked, braised|2.61
7247|23157|1300|"Beef, rib eye steak, bone-in, lip-on, separable lean only, trimmed to 1/8"" fat, choice, cooked, grilled"|2.61
5784|18282|1800|Muffins, corn, prepared from recipe, made with low fat (2%) milk|2.61
8411|35183|3500|Corn, dried, yellow (Northern Plains Indians)|2.61
3740|12737|1200|Nuts, mixed nuts, oil roasted, with peanuts, lightly salted|2.61
6706|21112|2100|Fast foods, hamburger; single, large patty; plain|2.61
3965|13812|1300|"Beef, chuck, arm pot roast, separable lean and fat, trimmed to 1/8"" fat, choice, cooked, braised"|2.61
3708|12200|1200|Nuts, formulated, wheat-based, all flavors except macadamia, without salt|2.6
1269|6101|600|Soup, cream of vegetable, dry, powder|2.6
8068|28266|1800|"KEEBLER, READY CRUST, Graham Pie Crust (10""), Reduced Fat"|2.6
7155|23065|1300|"Beef, chuck, shoulder clod, shoulder tender, medallion, separable lean and fat, trimmed to 0"" fat, select, cooked, grilled"|2.6
6730|21148|2100|School Lunch, pizza, TONY'S SMARTPIZZA Whole Grain 4x6 Pepperoni Pizza 50/50 Cheese, frozen|2.6
8018|28215|1800|MURRAY, JACKS Vanilla Wafers|2.6
5966|18629|1800|PILLSBURY, Buttermilk Biscuits, Artificial Flavor, refrigerated dough|2.6
5990|18942|1800|Pie Crust, Cookie-type, Graham Cracker, Ready Crust|2.6
2058|8647|800|Cereals ready-to-eat, KASHI INDIGO MORNING|2.6
8069|28267|1800|KEEBLER, SANDIES, Simply Shortbread Cookies|2.6
5254|17156|1700|Game meat, bison, separable lean only, raw (Bison bison)|2.6
5717|18211|1800|Puff pastry, frozen, ready-to-bake, baked|2.6
6039|18991|1800|BARBARA DEE, Winter Mints Cookies|2.6
5154|17056|1700|"Lamb, domestic, shoulder, blade, separable lean only, trimmed to 1/4"" fat, choice, cooked, braised"|2.6
7611|23568|1300|Beef, ground, 85% lean meat / 15% fat, patty, cooked, broiled|2.6
7540|23462|1300|Beef, New Zealand, imported, hind shin, separable lean and fat, cooked, braised|2.6
8181|28380|1800|PEPPERIDGE FARM, Whole Grain 15 Grain Bread|2.6
5427|17330|1700|Game meat , bison, ground, raw (Bison bison)|2.6
8196|28395|1800|PEPPERIDGE FARM, Whole Grain Honey Whole Wheat Bread|2.6
2059|8648|800|Cereals ready-to-eat, KASHI Simply Maize|2.6
5701|18190|1800|Cookies, peanut butter sandwich, regular|2.6
7883|28077|1800|KEEBLER, FUDGE SHOPPE, Cheesecake Middles, Original Graham Cookies|2.6
7881|28075|1800|KEEBLER, E.L. FUDGE, Double Stuffed Cookies|2.6
8197|28396|1800|PEPPERIDGE FARM, Whole Grain Oatmeal Bread|2.6
5824|18334|1800|Pie crust, standard-type, frozen, ready-to-bake, enriched|2.6
7855|28048|1800|KEEBLER, BAKER'S TREASURES, Oatmeal Raisin Cookie, soft|2.6
7846|28038|1800|JACKSON'S, Old Fashioned Vanilla Wafers|2.6
5039|16523|1600|WORTHINGTON Vegetarian Burger, canned, unprepared|2.6
8337|35068|3500|Fish, salmon, king, chinook, liver (Alaska Native) (Oncorhynchus tshawytscha)|2.6
7845|28037|1800|JACKSON'S, Old Fashioned Lemon Jumble Cookies|2.6
8359|35093|3500|Willow, young leaves, chopped (Alaska Native) (Salix pulchra Cham.)|2.6
6665|21018|2100|Fast foods, egg, scrambled|2.59
6708|21114|2100|Fast foods, hamburger; double, large patty; with condiments and vegetables|2.59
8123|28321|1800|Rolls, hamburger, whole grain white, calcium-fortified|2.59
8094|28292|1800|Crackers, multigrain|2.59
7617|23574|1300|Beef, ground, 80% lean meat / 20% fat, patty, cooked, pan-broiled|2.59
2371|9299|900|Raisins, seeded (Vitis vinifera)|2.59
6533|20070|2000|Triticale flour, whole-grain|2.59
7474|23394|1300|"Beef, loin, top loin steak, boneless, lip-on, separable lean only, trimmed to 1/8"" fat, all grades, cooked, grilled"|2.59
7144|23054|1300|"Beef, chuck, shoulder clod, shoulder tender, medallion, separable lean and fat, trimmed to 0"" fat, all grades, cooked, grilled"|2.59
7594|23541|1300|"Beef, plate, outside skirt steak, separable lean and fat, trimmed to 0"" fat, all grades, cooked, broiled"|2.58
8193|28392|1800|PEPPERIDGE FARM, Farmhouse 100% Whole Wheat Bread|2.58
1893|8220|800|Cereals ready-to-eat, QUAKER, Low Fat 100% Natural Granola with Raisins|2.58
7619|23576|1300|Beef, ground, 80% lean meat / 20% fat, loaf, cooked, baked|2.58
7472|23392|1300|"Beef, loin, top loin steak, boneless, lip-on, separable lean only, trimmed to 1/8"" fat, choice, cooked, grilled"|2.58
5690|18178|1800|Cookies, oatmeal, commercially prepared, regular|2.58
6705|21111|2100|Fast foods, hamburger; double, regular patty; with condiments|2.58
7125|23035|1300|"Beef, chuck, shoulder clod, shoulder tender, medallion, separable lean and fat, trimmed to 0"" fat, choice, cooked, grilled"|2.58
3691|12157|1200|Nuts, walnuts, dry roasted, with salt added|2.57
3851|13395|1300|"Beef, rib, small end (ribs 10-12), separable lean only, trimmed to 0"" fat, choice, cooked, broiled"|2.57
5574|18015|1800|Biscuits, plain or buttermilk, refrigerated dough, higher fat, baked|2.57
2817|11005|1100|Arrowhead, raw (Sagittaria latifolia)|2.57
5874|18402|1800|Pie crust, standard-type, prepared from recipe, unbaked|2.57
970|5148|500|Goose, domesticated, meat only, raw|2.57
6822|21297|2100|"PIZZA HUT 14"" Pepperoni Pizza, Pan Crust"|2.57
7528|23450|1300|Beef, New Zealand, imported, brisket point end, separable lean and fat, cooked, braised|2.57
3677|12138|1200|Nuts, mixed nuts, oil roasted, without peanuts, without salt added|2.57
3852|13396|1300|"Beef, rib, small end (ribs 10-12), separable lean only, trimmed to 0"" fat, select, cooked, broiled"|2.57
7128|23038|1300|"Beef, chuck, shoulder clod, shoulder top and center steaks, separable lean and fat, trimmed to 0"" fat, choice, cooked, grilled"|2.57
6532|20069|2000|Triticale (X Triticosecale spp.)|2.57
3732|12638|1200|Nuts, mixed nuts, oil roasted, without peanuts, with salt added|2.57
3945|13649|1300|"Beef, shoulder pot roast or steak, boneless, separable lean only, trimmed to 0"" fat, select, raw"|2.57
6692|21096|2100|Fast foods, cheeseburger; single, large patty; plain|2.57
6355|19405|2500|Snacks, granola bars, soft, uncoated, chocolate chip, graham and marshmallow|2.57
2866|11086|1100|Beet greens, raw (Beta vulgaris)|2.57
8464|36013|3600|Restaurant, family style, sirloin steak|2.57
5827|18337|1800|Puff pastry, frozen, ready-to-bake|2.56
4018|13867|1300|"Beef, round, full cut, separable lean and fat, trimmed to 1/8"" fat, select, cooked, broiled"|2.56
6064|19020|2500|Snacks, granola bars, soft, uncoated, plain|2.56
7202|23112|1300|"Beef, shoulder pot roast or steak, boneless, separable lean and fat, trimmed to 0"" fat, select, raw"|2.56
2000|8546|2500|Rice and Wheat cereal bar|2.56
7453|23373|1300|"Beef, loin, tenderloin steak, boneless, separable lean only, trimmed to 0"" fat, choice, raw"|2.55
7447|23367|1300|"Beef, loin, tenderloin roast, boneless, separable lean only, trimmed to 0"" fat, choice, raw"|2.55
3779|13318|1300|Beef, variety meats and by-products, brain, raw|2.55
6718|21129|2100|Fast foods, hush puppies|2.55
5709|18201|1800|Cookies, peanut butter sandwich, special dietary|2.55
6886|21388|2100|Fast foods, miniature cinnamon rolls|2.55
7574|23503|1300|USDA Commodity, beef, patties (100%), frozen, cooked|2.55
4016|13865|1300|"Beef, round, full cut, separable lean and fat, trimmed to 1/8"" fat, choice, cooked, broiled"|2.55
6237|19220|1900|Desserts, rennin, chocolate, dry mix|2.55
4832|16095|1600|Peanuts, virginia, raw (Arachis hypogaea)|2.55
6828|21303|2100|"Fast Food, Pizza Chain, 14"" pizza, pepperoni topping, thick crust"|2.55
5542|17445|1700|"Lamb, Australian, imported, fresh, leg, trotter off, bone-in, separable lean only, trimmed to 1/8"" fat, cooked, roasted"|2.55
7748|25060|2500|Snack, Pretzel, hard chocolate coated|2.54
4047|13896|1300|"Beef, round, top round, steak, separable lean and fat, trimmed to 1/8"" fat, choice, cooked, broiled"|2.54
6527|20064|2000|Rye flour, medium|2.54
7524|23446|1300|Beef, New Zealand, imported, bolar blade, separable lean and fat, cooked, fast roasted|2.54
6806|21281|2100|"DOMINO'S 14"" Pepperoni Pizza, Ultimate Deep Dish Crust"|2.54
5651|18126|1800|Cake, shortcake, biscuit-type, prepared from recipe|2.54
1922|8290|800|Cereals ready-to-eat, HEALTH VALLEY, FIBER 7 Flakes|2.54
6053|19005|2500|Snacks, corn-based, extruded, cones, plain|2.54
8117|28315|1800|Bread, cinnamon|2.54
7423|23343|1300|"Beef, loin, tenderloin steak, boneless, separable lean and fat, trimmed to 0"" fat, choice, raw"|2.53
3963|13810|1300|"Beef, chuck, arm pot roast, separable lean and fat, trimmed to 1/8"" fat, all grades, cooked, braised"|2.53
5753|18248|1800|Doughnuts, cake-type, plain (includes unsugared, old-fashioned)|2.53
7264|23174|1300|"Beef, rib eye steak, boneless, lip off, separable lean only, trimmed to 0"" fat, all grades, cooked, grilled"|2.53
8182|28381|1800|PEPPERIDGE FARM, Farmhouse Hearty White Bread|2.53
7386|23306|1300|Beef, Australian, imported, grass-fed, loin, top sirloin cap-off steak/roast, boneless, separable lean only, raw|2.53
4044|13893|1300|"Beef, round, top round steak, separable lean and fat, trimmed to 1/8"" fat, all grades, cooked, broiled"|2.53
3680|12142|1200|Nuts, pecans (Carya illinoinensis)|2.53
5688|18176|1800|Cookies, marshmallow, chocolate-coated (includes marshmallow pies)|2.53
7153|23063|1300|"Beef, round, outside round, bottom round, steak, separable lean and fat, trimmed to 0"" fat, all grades, raw"|2.53
7008|21603|2100|School Lunch, pizza, pepperoni topping, thick crust, whole grain, frozen, cooked|2.53
7156|23066|1300|"Beef, chuck, short ribs, boneless, separable lean only, trimmed to 0"" fat, choice, raw"|2.53
7005|21600|2100|School Lunch, pizza, cheese topping, thin crust, whole grain, frozen, cooked|2.53
3826|13367|1300|"Beef, brisket, whole, separable lean and fat, trimmed to 0"" fat, all grades, cooked, braised"|2.53
6004|18956|1800|Keikitos (muffins), Latino bakery item|2.53
6055|19008|2500|Snacks, corn-based, extruded, puffs or twists, cheese-flavor|2.53
8244|32011|2200|Yellow rice with seasoning, dry packet mix, unprepared|2.53
7190|23100|1300|"Beef, rib eye steak, boneless, lip-on, separable lean only, trimmed to 1/8"" fat, all grades, cooked, grilled"|2.53
8122|28320|1800|English muffins, whole grain white|2.53
7417|23337|1300|"Beef, loin, tenderloin roast, boneless, separable lean and fat, trimmed to 0"" fat, choice, raw"|2.52
6820|21295|2100|"PIZZA HUT 14"" Cheese Pizza, THIN 'N CRISPY Crust"|2.52
3975|13822|1300|"Beef, chuck eye roast, boneless, America's Beef Roast, separable lean only, trimmed to 0"" fat, choice, cooked, roasted"|2.52
3937|13520|1300|"Beef, shoulder top blade steak, boneless, separable lean only, trimmed to 0"" fat, choice, raw"|2.52
6006|18958|1800|Pan Dulce, LA RICURA, Salpora de Arroz con Azucar, cookie-like, contains wheat flour and rice flour|2.52
7520|23442|1300|Beef, New Zealand, imported, variety meats and by-products, tongue, cooked, boiled|2.52
4051|13900|1300|"Beef, round, top round, steak, separable lean and fat, trimmed to 1/8"" fat, select, cooked, broiled"|2.52
7530|23452|1300|Beef, New Zealand, imported, chuck eye roll, separable lean and fat, cooked, braised|2.52
6827|21302|2100|"Fast Food, Pizza Chain, 14"" pizza, pepperoni topping, regular crust"|2.52
5539|17442|1700|"Lamb, Australian, imported, fresh, tenderloin, boneless, separable lean only, trimmed to 1/8"" fat, cooked, roasted"|2.52
5556|17459|1700|"Lamb, Australian, imported, fresh, tenderloin, boneless, separable lean and fat, trimmed to 1/8"" fat, cooked, roasted"|2.52
7136|23046|1300|"Beef, round, knuckle, tip center, steak, separable lean and fat, trimmed to 0"" fat, choice, cooked, grilled"|2.51
3707|12198|1200|Seeds, sesame butter, tahini, from raw and stone ground kernels|2.51
7177|23087|1300|"Beef, chuck, mock tender steak, boneless, separable lean only, trimmed to 0"" fat, choice, raw"|2.51
4986|16363|1600|Cowpeas, common (blackeyes, crowder, southern), mature seeds, cooked, boiled, with salt|2.51
3936|13519|1300|"Beef, shoulder top blade steak, boneless, separable lean only, trimmed to 0"" fat, all grades, raw"|2.51
7044|22918|2200|Burrito, bean and cheese, frozen|2.51
4801|16063|1600|Cowpeas, common (blackeyes, crowder, southern), mature seeds, cooked, boiled, without salt|2.51
7152|23062|1300|"Beef, round, knuckle, tip center, steak, separable lean and fat, trimmed to 0"" fat, all grades, cooked, grilled"|2.51
7395|23315|1300|Beef, Australian, imported, grass-fed, loin, top sirloin cap-off steak/roast, boneless, separable lean and fat, raw|2.51
7225|23135|1300|"Beef, chuck eye Country-Style ribs, boneless, separable lean and fat, trimmed to 0"" fat, choice, cooked, braised"|2.51
3938|13523|1300|"Beef, shoulder top blade steak, boneless, separable lean only, trimmed to 0"" fat, select, raw"|2.51
7470|23390|1300|"Beef, loin, top loin steak, boneless, lip-on, separable lean and fat, trimmed to 1/8"" fat, select, cooked, grilled"|2.51
6907|21415|2100|POPEYES, biscuit|2.51
7254|23164|1300|"Beef, plate steak, boneless, inside skirt, separable lean only, trimmed to 0"" fat, choice, cooked, grilled"|2.51
5911|18448|1800|Taco shells, baked, without added salt|2.5
6727|21145|2100|"School Lunch, pizza, BIG DADDY'S LS 16"" 51% Whole Grain Rolled Edge Cheese Pizza, frozen"|2.5
2338|9265|900|Persimmons, native, raw (Diospyros virginiana)|2.5
6116|19084|1900|Candies, HERSHEY'S GOLDEN ALMOND SOLITAIRES|2.5
7019|22126|1600|LOMA LINDA Big Franks, canned, unprepared|2.5
5903|18437|1800|English muffins, plain, enriched, without calcium propionate(includes sourdough)|2.5
6061|19016|2500|Snacks, granola bars, hard, almond|2.5
6777|21251|2100|BURGER KING, Cheeseburger|2.5
968|5146|500|Goose, domesticated, meat and skin, raw (Anser anser)|2.5
6974|21495|2100|"DOMINO'S 14"" Sausage Pizza, Ultimate Deep Dish Crust"|2.5
6476|20005|2000|Barley, pearled, raw|2.5
7213|23123|1300|"Beef, chuck, mock tender steak, boneless, separable lean and fat, trimmed to 0"" fat, choice, raw"|2.5
3162|11451|1100|Soybeans, green, cooked, boiled, drained, without salt|2.5
1863|8148|800|Cereals ready-to-eat, POST, Shredded Wheat, original spoon-size|2.5
7836|28028|1800|FAMOUS AMOS, Chocolate Chip Pecan Cookies|2.5
8028|28226|1800|MURRAY, SUGAR FREE, Pecan Shortbread Cookies|2.5
5091|16613|1600|MORNINGSTAR FARMS Breakfast Sandwich Veggie Sausage Egg & Cheese English Muffin, frozen, unprepared|2.5
5077|16592|1600|MORNINGSTAR FARMS California Turk'y Burger, frozen, unprepared|2.5
5062|16557|1600|MORNINGSTAR FARMS Chik Patties, frozen, unprepared|2.5
3467|11853|1100|Soybeans, green, cooked, boiled, drained, with salt|2.5
7622|23579|1300|Beef, ground, 75% lean meat / 25% fat, patty, cooked, pan-broiled|2.5
