|NDB_No|FdGrp_Cd|Long_Desc|FE
1152|5697|500|Turkey from whole, light meat, meat only, with added solution, cooked, roasted|0.55
1457|6431|600|CAMPBELL'S CHUNKY, New England Clam Chowder|0.55
3466|11852|1100|Salsify, cooked, boiled, drained, with salt|0.55
3153|11438|1100|Salsify, cooked, boiled, drained, without salt|0.55
2657|10210|1000|Pork, fresh, loin, sirloin (chops or roasts), boneless, separable lean and fat, raw|0.55
6933|21442|2100|POPEYES, Fried Chicken, Mild, Breast, meat only, skin and breading removed|0.55
7070|22956|2200|Lasagna, Vegetable, frozen, baked|0.55
3213|11518|1100|Taro, raw (Colocasia esculenta)|0.55
1342|6229|600|PREGO Pasta, Mushroom and Garlic Italian Sauce, ready-to-serve|0.55
3097|11370|1100|Potatoes, hash brown, home-prepared|0.55
3512|11901|1100|Corn, sweet, white, cooked, boiled, drained, without salt|0.55
1336|6222|600|PREGO Pasta, Diced Onion and Garlic Italian Sauce, ready-to-serve|0.55
2155|9037|900|Avocados, raw, all commercial varieties (Persea americana)|0.55
1185|5730|500|Turkey, wing, from whole bird, meat only, with added solution, roasted|0.55
1335|6221|600|PREGO Pasta, Chunky Garden Mushroom Supreme Italian Sauce, ready-to-serve|0.55
1577|6932|600|PREGO Pasta, Traditional Italian Sauce, ready-to-serve|0.55
8538|36609|3600|CRACKER BARREL, macaroni n' cheese plate, from kid's menu|0.55
7778|27033|600|PREGO Pasta, Heart Smart- Traditional Sauce, ready-to-serve|0.55
8380|35150|3500|Fish, salmon, coho (silver), raw (Alaska Native)|0.55
1175|5720|500|Turkey, back, from whole bird, meat only, with added solution, roasted|0.55
1348|6235|600|P REGO Pasta, Roasted Garlic and Herb Italian Sauce, ready-to-serve|0.55
4719|15242|1500|Crustaceans, crayfish, mixed species, farmed, raw (Astacus, Orconectes, and Procambarus spp.)|0.55
3198|11497|1100|Succotash, (corn and limas), canned, with cream style corn|0.55
1173|5718|500|Turkey, breast, from whole bird, meat only, with added solution, roasted|0.55
1334|6220|600|PREGO Pasta, Chunky Garden Mushroom and Green Pepper Italian Sauce, ready-to-serve|0.55
4560|15079|1500|Fish, salmon, chum, raw (Oncorhynchus keta (Walbaum))|0.55
4543|15062|1500|Fish, pike, northern, raw (Esox lucius L.)|0.55
1239|6045|600|Soup, onion, canned, condensed|0.55
3513|11902|1100|Corn, sweet, white, cooked, boiled, drained, with salt|0.55
2915|11145|1100|Celtuce, raw (Lactuca sativa)|0.55
1072|5348|500|Chicken, broilers or fryers, breast, meat and skin, cooked, rotisserie, original seasoning|0.55
6102|19067|1900|Candies, TWIZZLERS CHERRY BITES|0.55
2141|9023|900|Apricots, canned, water pack, without skin, solids and liquids|0.54
3114|11391|1100|Potatoes, hash brown, frozen, plain, prepared, pan fried in canola oil|0.54
1659|7051|700|Olive loaf, pork|0.54
6281|19283|1900|Frozen novelties, ice type, pop|0.54
457|3199|300|Babyfood, cereal, with eggs, strained|0.54
6945|21464|2100|Fast Foods, Fried Chicken, Breast, meat only, skin and breading removed|0.54
5867|18386|1800|Muffins, blueberry, toaster-type, toasted|0.54
2909|11137|1100|Cauliflower, frozen, unprepared|0.54
3212|11517|1100|Sweet potato, frozen, cooked, baked, without salt|0.54
1151|5696|500|Turkey from whole, light meat, meat only, with added solution, raw|0.54
1176|5721|500|Turkey, breast, from whole bird, meat only, with added solution, raw|0.54
1587|6964|600|Soup, tomato, low sodium, with water|0.54
1184|5729|500|Turkey, wing, from whole bird, meat only, with added solution, raw|0.54
5472|17375|1700|Lamb, New Zealand, imported, sweetbread, raw|0.54
3491|11877|1100|Sweet potato, frozen, cooked, baked, with salt|0.54
6243|19227|1900|Frostings, coconut-nut, ready-to-eat|0.54
2172|9059|900|Breadfruit, raw (Artocarpus altilis)|0.54
1157|5702|500|Turkey from whole, light meat, meat and skin, with added solution, raw|0.54
1460|6434|600|CAMPBELL'S CHUNKY Soups, Old Fashioned Vegetable Beef Soup|0.54
2672|10225|1000|Pork, fresh, loin, top loin (roasts), boneless, separable lean only, raw|0.54
3265|11601|1100|Yam, raw (Dioscorea spp.)|0.54
2468|9519|900|Guava nectar, with sucralose, canned|0.54
2671|10224|1000|Pork, fresh, loin, top loin (roasts), boneless, separable lean and fat, raw|0.53
3199|11499|1100|Succotash, (corn and limas), canned, with whole kernel corn, solids and liquids|0.53
8381|35151|3500|Fish, salmon, sockeye (red), raw (Alaska Native)|0.53
346|3050|300|Babyfood, dinner, spaghetti and tomato and meat, junior|0.53
8522|36411|3600|Restaurant, Latino, tamale, corn|0.53
3298|11656|1100|Corn pudding, home prepared|0.53
1629|7013|700|Bratwurst, pork, cooked|0.53
3211|11516|1100|Sweet potato, frozen, unprepared|0.53
6508|20041|2000|Rice, brown, medium-grain, cooked|0.53
8140|28338|1800|Bread, gluten-free, white, made with tapioca starch and brown rice flour|0.53
6916|21425|2100|KFC, Fried Chicken, ORIGINAL RECIPE, Breast, meat only, skin and breading removed|0.53
5368|17271|1700|Veal, breast, whole, boneless, separable lean and fat, raw (Bos taurus)|0.53
2181|9068|900|Cherries, sour, red, frozen, unsweetened|0.53
3014|11267|1100|Mushrooms, shiitake, stir-fried (Lentinus edodes)|0.53
8460|36009|3600|T.G.I. FRIDAY'S, macaroni & cheese, from kid's menu|0.53
361|3073|300|Babyfood, dinner, vegetables chicken, strained|0.53
3711|12203|1200|Nuts, chestnuts, japanese, boiled and steamed|0.53
6648|20654|2000|Pasta, gluten-free, brown rice flour, cooked, TINKYADA|0.53
2905|11131|1100|Carrots, frozen, cooked, boiled, drained, without salt|0.53
8457|36006|3600|T.G.I. FRIDAY'S, FRIDAY'S Shrimp, breaded|0.53
2724|10894|1000|Pork, cured, ham, separable fat, boneless, heated|0.53
208|1244|100|Milk dessert bar, frozen, made from lowfat milk|0.53
3377|11760|1100|Carrots, frozen, cooked, boiled, drained, with salt|0.53
8172|28371|1800|UDI'S, Gluten Free, Soft & Delicious White Sandwich Bread|0.53
4159|14054|1400|Beverages, almond milk, chocolate, ready-to-drink|0.53
6645|20651|2000|Rice, brown, parboiled, cooked, UNCLE BENS|0.53
4571|15090|1500|Fish, scup, raw (Stenotomus chrysops L.)|0.53
3473|11859|1100|Squash, summer, crookneck and straightneck, frozen, cooked, boiled, drained, with salt|0.52
3266|11602|1100|Yam, cooked, boiled, drained, or baked, without salt|0.52
4738|15270|1500|Crustaceans, shrimp, raw (not previously frozen)|0.52
3028|11281|1100|Okra, frozen, cooked, boiled, drained, without salt|0.52
34|1035|100|Cheese, provolone|0.52
3081|11354|1100|Potatoes, white, flesh and skin, raw (Solanum tuberosum)|0.52
6432|19879|1900|Ice creams, BREYERS, All Natural Light Mint Chocolate Chip|0.52
3511|11900|1100|Corn, sweet, white, raw (Zea mays)|0.52
2483|10005|1000|Pork, fresh, belly, raw|0.52
3508|11897|1100|Yam, cooked, boiled, drained, or baked, with salt|0.52
4567|15086|1500|Fish, salmon, sockeye, cooked, dry heat|0.52
176|1208|100|Cheese, provolone, reduced fat|0.52
3375|11758|1100|Carrots, canned, no salt added, solids and liquids|0.52
502|3298|300|Babyfood, dinner, broccoli and chicken, junior|0.52
8504|36053|3600|CARRABBA'S ITALIAN GRILL, cheese ravioli with marinara sauce|0.52
3420|11804|1100|Okra, frozen, cooked, boiled, drained, with salt|0.52
2931|11167|1100|Corn, sweet, yellow, raw (Zea mays)|0.52
5627|18086|1800|Cake, angelfood, commercially prepared|0.52
3176|11474|1100|Squash, summer, crookneck and straightneck, frozen, cooked, boiled, drained, without salt|0.52
3530|11919|1100|Peppers, sweet, red, frozen, chopped, boiled, drained, with salt|0.52
3072|11338|1100|Peppers, sweet, green, frozen, chopped, boiled, drained, without salt|0.52
3529|11918|1100|Peppers, sweet, red, frozen, chopped, boiled, drained, without salt|0.52
20|1021|100|Cheese, gjetost|0.52
2391|9325|900|Fruit salad, (pineapple and papaya and banana and guava), tropical, canned, heavy syrup, solids and liquids|0.52
2902|11126|1100|Carrots, canned, regular pack, solids and liquids|0.52
5885|18419|1800|Cake, pudding-type, white, unenriched, dry mix|0.52
3441|11825|1100|Peppers, sweet, green, frozen, chopped, cooked, boiled, drained, with salt|0.52
6570|20117|2000|Noodles, japanese, somen, cooked|0.52
2544|10066|1000|Pork, fresh, loin, top loin (chops), boneless, separable lean only, raw|0.51
1080|5358|500|Chicken, broiler, rotisserie, BBQ, breast meat and skin|0.51
3181|11479|1100|Squash, summer, zucchini, includes skin, frozen, unprepared|0.51
456|3198|300|Babyfood, cereal, with egg yolks, junior|0.51
6921|21430|2100|KFC, Fried Chicken, EXTRA CRISPY, Breast, meat only, skin and breading removed|0.51
3221|11527|1100|Tomatoes, green, raw (Solanum lycopersicum)|0.51
1255|6067|600|Soup, chunky vegetable, canned, ready-to-serve|0.51
5779|18277|1800|Muffins, blueberry, toaster-type|0.51
4739|15271|1500|Crustaceans, shrimp, cooked (not previously frozen)|0.51
145|1166|100|Cheese, mexican, queso asadero|0.51
6811|21286|2100|"PAPA JOHN'S 14"" Cheese Pizza, Thin Crust"|0.51
1140|5685|500|Chicken, skin (drumsticks and thighs), with added solution, raw|0.51
6144|19112|1900|Candies, TWIZZLERS Strawberry Twists Candy|0.51
1574|6749|600|Soup, beef and vegetables, canned, ready-to-serve|0.51
3039|11292|1100|Onions, young green, tops only (Allium cepa)|0.51
5639|18105|1800|Coffeecake, creme-filled with chocolate frosting|0.51
8397|35169|3500|Fish, sheefish, raw (Alaska Native)|0.5
2540|10062|1000|Pork, fresh, loin, top loin (chops), boneless, separable lean and fat, raw|0.5
498|3290|300|Babyfood, carrots and beef, strained|0.5
3008|11260|1100|Mushrooms, white, raw (Agaricus bisporus)|0.5
2120|9002|900|Acerola juice, raw|0.5
1559|6720|600|Sauce, cheese sauce mix, dry|0.5
7082|22971|2200|Potato salad with egg|0.5
2725|10895|1000|Pork, cured, ham, separable fat, boneless, unheated|0.5
4164|14059|1400|Beverages, KELLOGG'S, SPECIAL K Protein Shake|0.5
1584|6961|600|Sauce, peppers, hot, chili, mature red, canned|0.5
8342|35073|3500|Soup, fish, homemade (Alaska Native)|0.5
8698|43297|1000|Pork, oriental style, dehydrated|0.5
8643|43020|400|Salad dressing, blue or roquefort cheese, low calorie|0.5
1300|6167|600|Sauce, homemade, white, thick|0.5
3088|11361|1100|Potatoes, roasted, salt added in processing, frozen, unprepared|0.5
4506|15025|1500|Fish, eel, mixed species, raw (Anguilla spp.)|0.5
7803|27064|600|Wasabi|0.5
2833|11026|1100|Bamboo shoots, raw (Phyllostachys spp.)|0.5
647|4026|400|Salad dressing, mayonnaise, soybean and safflower oil, with salt|0.5
376|3096|300|Babyfood, vegetable, green beans and potatoes|0.5
4619|15141|1500|Crustaceans, crab, blue, canned|0.5
4618|15140|1500|Crustaceans, crab, blue, cooked, moist heat|0.5
364|3077|300|Babyfood, dinner, pasta with vegetables|0.5
649|4028|400|Salad dressing, mayonnaise, imitation, milk cream|0.5
3548|11938|1100|Mushroom, white, exposed to ultraviolet light, raw|0.5
3067|11329|1100|Peppers, hot chili, green, canned, pods, excluding seeds, solids and liquids|0.5
4609|15131|1500|Fish, whitefish, mixed species, smoked|0.5
3436|11820|1100|Peppers, hot chili, red, canned, excluding seeds, solids and liquids|0.5
6610|20421|2000|Pasta, cooked, unenriched, without added salt|0.5
8736|43417|300|Babyfood, meat, beef with vegetables, toddler|0.5
6294|19307|1900|Candies, MARS SNACKFOOD US, POP'ABLES MILKY WAY Brand Bite Size Candies|0.5
5816|18323|1800|Pie, peach|0.5
673|4145|400|Salad dressing, mayonnaise, soybean oil, without salt|0.5
6150|19118|1900|Candies, NESTLE, OH HENRY! Bar|0.5
5|1006|100|Cheese, brie|0.5
1240|6046|600|Soup, cream of onion, canned, condensed|0.5
6623|20521|2000|Pasta, cooked, unenriched, with added salt|0.5
1212|6010|600|Soup, cream of celery, canned, condensed|0.5
4488|15007|1500|Fish, butterfish, raw (Peprilus triacanthus (Peck))|0.5
2821|11009|1100|Artichokes, (globe or french), frozen, unprepared|0.5
3573|11964|1100|Nopales, cooked, without salt|0.5
8352|35085|3500|Whale, bowhead, subcutaneous fat (blubber) (Alaska Native) (Balaena mysticetus)|0.5
2282|9195|900|Olives, pickled, canned or bottled, green|0.49
6561|20106|2000|Macaroni, vegetable, enriched, cooked|0.49
6395|19719|1900|Jams and preserves, apricot|0.49
4495|15014|1500|Fish, cisco, smoked|0.49
4498|15017|1500|Fish, cod, Atlantic, canned, solids and liquid|0.49
2233|9125|900|Grapefruit juice, white, frozen concentrate, unsweetened, undiluted|0.49
363|3076|300|Babyfood, dinner, vegetables, noodles and chicken, junior|0.49
4497|15016|1500|Fish, cod, Atlantic, cooked, dry heat|0.49
1447|6415|600|CAMPBELL'S CHUNKY Soups, Hearty Beef Barley Soup|0.49
1200|5746|500|Chicken, broiler or fryers, breast, skinless, boneless, meat only, cooked, braised|0.49
4913|16223|1600|Soymilk (All flavors), enhanced|0.49
31|1032|100|Cheese, parmesan, grated|0.49
8395|35167|3500|Fish, salmon, red, (sockeye), kippered (Alaska Native)|0.49
6181|19151|1900|Candies, REESE'S PIECES Candy|0.49
4613|15135|1500|Fish, yellowtail, mixed species, raw (Seriola spp.)|0.49
6944|21463|2100|Yogurt parfait, lowfat, with fruit and granola|0.49
6165|19135|1900|Candies, MARS SNACKFOOD US, MILKY WAY Bar|0.49
2385|9317|900|Strawberries, canned, heavy syrup pack, solids and liquids|0.49
8670|43143|1100|Cabbage, japanese style, fresh, pickled|0.49
1427|6391|600|CAMPBELL'S CHUNKY, Creamy Chicken and Dumplings Soup|0.49
6287|19297|1900|Jams and preserves|0.49
3317|11696|1100|Tomatoes, yellow, raw (Solanum lycopersicum)|0.49
6270|19265|1900|Ice creams, chocolate, light, no sugar added|0.48
2881|11101|1100|Brussels sprouts, frozen, cooked, boiled, drained, without salt|0.48
5886|18420|1800|Cake, yellow, unenriched, dry mix|0.48
2614|10164|1000|Pork, fresh, loin, center loin (chops), boneless, separable lean and fat, raw|0.48
4486|15005|1500|Fish, bluefish, raw (Pomatomus saltatrix (L.))|0.48
1561|6726|600|Soup, chicken mushroom chowder, chunky, ready-to-serve, single brand|0.48
8223|31027|1100|Potatoes, yellow fleshed, french fried, frozen, unprepared|0.48
4732|15264|1500|Salmon, sockeye, canned, drained solids, without skin and bones|0.48
2161|9043|900|Blackberry juice, canned|0.48
3182|11480|1100|Squash, summer, zucchini, includes skin, frozen, cooked, boiled, drained, without salt|0.48
3175|11473|1100|Squash, summer, crookneck and straightneck, frozen, unprepared|0.48
7781|27042|600|Soup, clam chowder, new england, canned, ready-to-serve|0.48
1312|6182|600|Soup, cream of mushroom, canned, condensed, reduced sodium|0.48
4892|16166|1600|Soymilk, chocolate, unfortified|0.48
1301|6168|600|Sauce, ready-to-serve, pepper or hot|0.48
249|1306|100|Ice cream, lowfat, no sugar added, cone, added peanuts and chocolate sauce|0.48
4935|16250|1600|SILK Vanilla soy yogurt (family size)|0.48
2250|9146|900|Jujube, raw (Ziziphus jujuba)|0.48
3476|11862|1100|Squash, summer, zucchini, includes skin, frozen, cooked, boiled, drained, with salt|0.48
4894|16168|1600|Soymilk, chocolate, with added calcium, vitamins A and D|0.48
3363|11746|1100|Brussels sprouts, frozen, cooked, boiled, drained, with salt|0.48
5804|18308|1800|Pie, cherry, commercially prepared|0.48
8217|31021|1100|Potatoes, hash brown, refrigerated, unprepared|0.48
2569|10094|1000|Pork, fresh, loin, center loin (chops), boneless, separable lean only, raw|0.48
6568|20115|2000|Noodles, japanese, soba, cooked|0.48
3482|11868|1100|Squash, winter, hubbard, baked, with salt|0.47
2887|11109|1100|Cabbage, raw (Brassica oleracea (Capitata Group))|0.47
4700|15223|1500|Fish, whitefish, mixed species, cooked, dry heat|0.47
5453|17356|1700|Lamb, New Zealand, imported, subcutaneous fat, raw|0.47
5665|18148|1800|Cheesecake prepared from mix, no-bake type|0.47
3308|11671|1100|Potatoes, o'brien, home-prepared|0.47
82|1090|100|Milk, dry, whole, with added vitamin D|0.47
3192|11490|1100|Squash, winter, hubbard, baked, without salt|0.47
2951|11199|1100|Yardlong bean, raw (Vigna unguiculata subsp. sesquipedalis)|0.47
144|1165|100|Cheese, mexican, queso anejo|0.47
458|3201|300|Babyfood, cereal, egg yolks and bacon, junior|0.47
2857|11058|1100|Beans, snap, canned, all styles, seasoned, solids and liquids|0.47
3391|11774|1100|Corn, sweet, yellow, frozen, kernels, cut off cob, boiled, drained, with salt|0.47
3316|11695|1100|Tomatoes, orange, raw (Solanum lycopersicum)|0.47
2926|11161|1100|Collards, raw (Brassica oleracea var. viridis)|0.47
180|1212|100|Milk, dry, whole, without added vitamin D|0.47
338|3042|300|Babyfood, dinner, vegetables and dumplings and beef, junior|0.47
2939|11179|1100|Corn, sweet, yellow, frozen, kernels cut off cob, boiled, drained, without salt|0.47
455|3197|300|Babyfood, cereal, with egg yolks, strained|0.47
3121|11398|1100|Potato puffs, frozen, unprepared|0.47
3531|11921|1100|Peppers, sweet, red, sauteed|0.47
6495|20027|2000|Cornstarch|0.47
7513|23435|1300|Beef, New Zealand, imported, subcutaneous fat, cooked|0.47
8710|43346|1900|Frozen novelties, juice type, orange|0.47
2768|10942|1000|Pork, fresh, composite of separable fat, with added solution, raw|0.47
146|1167|100|Cheese, mexican, queso chihuahua|0.47
2387|9319|900|Strawberries, frozen, sweetened, whole|0.47
4546|15065|1500|Fish, pollock, Atlantic, raw (Pollachius virens L.)|0.46
3439|11823|1100|Peppers, sweet, red, cooked, boiled, drained, without salt|0.46
4578|15097|1500|Fish, sheepshead, raw (Archosargus probatocephalus (Walbaum))|0.46
4699|15222|1500|Fish, turbot, european, cooked, dry heat|0.46
4912|16222|1600|Soymilk (all flavors), unsweetened, with added calcium, vitamins A and D|0.46
340|3044|300|Babyfood, dinner, macaroni and tomato and beef, strained|0.46
5800|18303|1800|Pie, banana cream, prepared from mix, no-bake type|0.46
4916|16228|1600|Soymilk, original and vanilla, light, unsweetened, with added calcium, vitamins A and D|0.46
4191|14096|1400|Alcoholic beverage, wine, table, red|0.46
3440|11824|1100|Peppers, sweet, red, cooked, boiled, drained, with salt|0.46
3438|11822|1100|Peppers, sweet, green, cooked, boiled, drained, with salt|0.46
524|3806|300|Infant formula, MEAD JOHNSON, ENFAMIL, low iron, ready-to-feed|0.46
4358|14347|1400|Shake, fast food, vanilla|0.46
822|5000|500|Chicken, broiler, rotisserie, BBQ, breast meat only|0.46
3560|11951|1100|Peppers, sweet, yellow, raw (Capsicum annuum)|0.46
8593|42187|1900|Frozen yogurts, flavors other than chocolate|0.46
2485|10007|1000|Pork, fresh, separable fat, cooked|0.46
3036|11289|1100|Onions, frozen, whole, unprepared|0.46
539|3825|300|Infant formula, MEAD JOHNSON, ENFAMIL, LIPIL, low iron, ready to feed, with ARA and DHA|0.46
7752|25065|2500|Snacks, Pretzels, gluten- free made with cornstarch and potato flour|0.46
4437|14602|1400|Alcoholic Beverage, wine, table, red, Merlot|0.46
3297|11655|1100|Carrot juice, canned|0.46
922|5100|500|Chicken, broilers or fryers, wing, meat and skin, raw|0.46
3583|11976|1100|Pepper, banana, raw (Capsicum anuum)|0.46
2298|9217|900|Orange-grapefruit juice, canned or bottled, unsweetened|0.46
3069|11334|1100|Peppers, sweet, green, cooked, boiled, drained, without salt|0.46
3588|11981|1100|Peppers, hungarian, raw|0.46
8592|42186|1900|Frozen yogurts, chocolate|0.46
1066|5342|500|Chicken, broilers or fryers, breast, meat only, cooked, rotisserie, original seasoning|0.45
6878|21380|2100|McDONALD'S, Fruit 'n Yogurt Parfait|0.45
7801|27062|600|Soup, beef barley, ready to serve|0.45
1486|6471|600|Soup, vegetable beef, canned, prepared with equal volume water|0.45
4592|15111|1500|Fish, swordfish, cooked, dry heat|0.45
7784|27045|600|Soup, beef and vegetables, reduced sodium, canned, ready-to-serve|0.45
5798|18301|1800|Pie, apple, commercially prepared, enriched flour|0.45
308|2068|200|Vinegar, red wine|0.45
3403|11787|1100|Drumstick pods, cooked, boiled, drained, with salt|0.45
3387|11770|1100|Corn, sweet, yellow, cooked, boiled, drained, with salt|0.45
4188|14092|1400|Beverages, chocolate almond milk, unsweetened, shelf-stable, fortified with vitamin D2 and E|0.45
8222|31026|1100|Potatoes, yellow fleshed, roasted, salt added in processing, frozen, unprepared|0.45
3278|11621|1100|Drumstick pods, cooked, boiled, drained, without salt|0.45
8168|28367|1800|SAGE VALLEY, Gluten Free Vanilla Sandwich Cookies|0.45
1479|6461|600|Soup, tomato beef with noodle, canned, prepared with equal volume water|0.45
2932|11168|1100|Corn, sweet, yellow, cooked, boiled, drained, without salt|0.45
5367|17270|1700|Veal, breast, separable fat, cooked (Bos taurus)|0.45
1201|5747|500|Chicken, broiler or fryers, breast, skinless, boneless, meat only, cooked, grilled|0.45
4689|15212|1500|Fish, salmon, pink, cooked, dry heat|0.45
505|3303|300|Babyfood, dinner, sweet potatoes and chicken, strained|0.45
1508|6544|600|CAMPBELL'S Homestyle Minestrone Soup|0.44
2598|10130|1000|Canadian bacon, unprepared|0.44
1426|6389|600|CAMPBELL'S CHUNKY Soups, Beef with White and Wild Rice Soup|0.44
424|3162|300|Babyfood, fruit, papaya and applesauce with tapioca, strained|0.44
1506|6541|600|CAMPBELL'S Homestyle Italian-Style Wedding Soup|0.44
1431|6396|600|CAMPBELL'S CHUNKY Soups, Fajita Chicken with Rice & Beans Soup|0.44
1480|6462|600|CAMPBELL'S CHUNKY Soups, Steak 'N' Potato Soup|0.44
1505|6537|600|CAMPBELL'S Homestyle HEALTHY REQUEST Mexican Style Chicken Tortilla|0.44
25|1026|100|Cheese, mozzarella, whole milk|0.44
1455|6429|600|CAMPBELL'S CHUNKY Soups, Manhattan Clam Chowder|0.44
4933|16248|1600|SILK Mocha, soymilk|0.44
3006|11258|1100|Mountain yam, hawaii, raw (Dioscorea pentaphylla)|0.44
1363|6252|600|CAMPBELL'S CHUNKY Microwavable Bowls, Sirloin Burger with Country Vegetables Soup, ready-to-serve|0.44
2904|11130|1100|Carrots, frozen, unprepared|0.44
17|1018|100|Cheese, edam|0.44
3150|11435|1100|Rutabagas, raw (Brassica napus var. napobrassica)|0.44
7768|27018|600|CAMPBELL'S Homestyle Microwaveable Bowls, HEALTHY REQUEST Mexican Style Tortilla|0.44
4359|14350|1400|Strawberry-flavor beverage mix, powder|0.44
1442|6409|600|Soup, beef noodle, canned, prepared with equal volume water|0.44
1441|6408|600|CAMPBELL'S CHUNKY Soups, HEALTHY REQUEST Vegetable Soup|0.44
2615|10165|1000|Pork, cured, salt pork, raw|0.44
3291|11644|1100|Squash, winter, all varieties, cooked, baked, without salt|0.44
3016|11269|1100|Mushrooms, shiitake, cooked, without salt|0.44
1437|6403|600|CAMPBELL'S CHUNKY Soups, Grilled Sirloin Steak with Hearty Vegetables Soup|0.44
1484|6468|600|Soup, vegetarian vegetable, canned, prepared with equal volume water|0.44
1477|6457|600|CAMPBELL'S CHUNKY Soups, Slow Roasted Beef with Mushrooms Soup|0.44
4924|16239|1600|SILK Light Vanilla, soymilk|0.44
4921|16236|1600|SILK Vanilla, soymilk|0.44
8220|31024|1100|Sweet Potatoes, french fried, crosscut, frozen, unprepared|0.44
4923|16238|1600|SILK Light Plain, soymilk|0.44
4920|16235|1600|SILK Plain, soymilk|0.44
1462|6438|600|CAMPBELL'S CHUNKY Soups, Salisbury Steak with Mushrooms & Onions Soup|0.44
4917|16229|1600|Soymilk (All flavors), lowfat, with added calcium, vitamins A and D|0.44
4926|16241|1600|SILK Plus Omega-3 DHA, soymilk|0.44
4927|16242|1600|SILK Plus for Bone Health, soymilk|0.44
3414|11798|1100|Mushrooms, shiitake, cooked, with salt|0.44
1541|6617|600|CAMPBELL'S Homestyle Light Italian-Style Wedding Soup|0.44
4928|16243|1600|SILK Plus Fiber, soymilk|0.44
1362|6251|600|CAMPBELL'S CHUNKY Microwavable Bowls, Old Fashioned Vegetable Beef Soup, ready-to-serve|0.44
4532|15051|1500|Fish, mackerel, spanish, raw (Scombermorus maculatus (Mitchill))|0.44
4929|16244|1600|SILK Unsweetened, soymilk|0.44
4930|16245|1600|SILK Very Vanilla, soymilk|0.44
8209|31013|1100|CAMPBELL'S, V8 Vegetable Juice, Spicy Hot V8|0.44
36|1037|100|Cheese, ricotta, part skim milk|0.44
4910|16216|1600|Vitasoy USA, Vitasoy Organic Classic Original Soymilk|0.44
3172|11467|1100|Squash, summer, crookneck and straightneck, raw (Cucurbita spp.)|0.44
3477|11863|1100|Squash, winter, all varieties, cooked, baked, with salt|0.44
4932|16247|1600|SILK Chai, soymilk|0.44
2170|9056|900|Boysenberries, canned, heavy syrup (Rubus ursinus var. loganobaccus)|0.43
1359|6248|600|Soup, oyster stew, canned, prepared with equal volume milk|0.43
2831|11024|1100|Balsam-pear (bitter gourd), pods, raw (Momordica charantia)|0.43
2146|9028|900|Apricots, canned, heavy syrup pack, without skin, solids and liquids|0.43
4703|15226|1500|Crustaceans, crab, dungeness, cooked, moist heat|0.43
8720|43379|100|Cheese, pasteurized process, swiss, low fat|0.43
3283|11626|1100|Beans, mung, mature seeds, sprouted, canned, drained solids|0.43
2912|11142|1100|Celeriac, cooked, boiled, drained, without salt|0.43
4|1005|100|Cheese, brick|0.43
2424|9422|900|Durian, raw or frozen (Durio zibethinus)|0.43
2397|9352|900|Blueberries, canned, light syrup, drained|0.43
496|3287|300|Babyfood, dinner, beef noodle, junior|0.43
8691|43275|100|Cheese, pasteurized process, American, low fat|0.43
8455|36004|3600|APPLEBEE'S, mozzarella sticks|0.43
3437|11821|1100|Peppers, sweet, red, raw|0.43
2393|9328|900|Maraschino cherries, canned, drained|0.43
1203|5749|500|Chicken, broiler or fryers, breast, skinless, boneless, meat only, with added solution, cooked, grilled|0.43
4566|15085|1500|Fish, salmon, sockeye, raw|0.43
33|1034|100|Cheese, port de salut|0.43
4914|16225|1600|Soymilk, original and vanilla, light, with added calcium, vitamins A and D|0.43
2128|9010|900|Apples, dehydrated (low moisture), sulfured, stewed|0.43
1202|5748|500|Chicken, broiler or fryers, breast, skinless, boneless, meat only, with added solution, cooked, braised|0.43
7056|22942|2200|SPAGHETTIOS, SpaghettiOs A to Z's with Meatballs|0.43
1230|6032|600|Soup, beef broth bouillon and consomme, canned, condensed|0.43
3380|11763|1100|Celeriac, cooked, boiled, drained, with salt|0.43
1182|5727|500|Turkey, retail parts, breast, meat and skin, with added solution, raw|0.43
3537|11927|1100|Mountain yam, hawaii, cooked, steamed, with salt|0.43
5011|16425|1600|Soy sauce, reduced sodium, made from hydrolyzed vegetable protein|0.43
3007|11259|1100|Mountain yam, hawaii, cooked, steamed, without salt|0.43
2374|9304|900|Raspberries, canned, red, heavy syrup pack, solids and liquids|0.42
2914|11144|1100|Celery, cooked, boiled, drained, without salt|0.42
1248|6056|600|Soup, cream of shrimp, canned, condensed|0.42
3520|11909|1100|Corn, sweet, white, canned, vacuum pack, no salt added|0.42
