|NDB_No|FdGrp_Cd|Long_Desc|FE
6830|21305|2100|Fast foods, griddle cake sandwich, egg, cheese, and sausage|1.51
6845|21329|2100|McDONALD'S, Sausage, Egg & Cheese McGRIDDLES|1.51
4101|13958|1300|"Beef, bottom sirloin, tri-tip roast, separable lean and fat, trimmed to 0"" fat, select, raw"|1.51
8723|43387|1100|Turnip greens, canned, no salt added|1.51
6770|21244|2100|WENDY'S, Homestyle Chicken Fillet Sandwich|1.5
5019|16500|1600|LOMA LINDA Little Links, canned, unprepared|1.5
5021|16504|1600|LOMA LINDA Tender Rounds with Gravy, canned, unprepared|1.5
6783|21258|2100|BURGER KING, Premium Fish Sandwich|1.5
8007|28204|1800|MOTHER'S, Jungle Animal Cookies|1.5
5133|17035|1700|"Lamb, domestic, shoulder, whole (arm and blade), separable lean and fat, trimmed to 1/4"" fat, choice, raw"|1.5
8013|28210|1800|MURRAY, SUGAR FREE, Vanilla Sugar Wafer|1.5
3261|11595|1100|Winged beans, immature seeds, raw (Psophocarpus tetragonolobus)|1.5
5521|17424|1700|Veal, ground, cooked, pan-fried|1.5
7899|28094|1800|KEEBLER, FUDGE SHOPPE, Jumbo Fudge Sticks, Vanilla|1.5
3649|12096|1200|Nuts, chestnuts, chinese, roasted|1.5
1648|7034|700|Headcheese, pork|1.5
5028|16511|1600|WORTHINGTON Choplets, canned, unprepared|1.5
6810|21285|2100|"PAPA JOHN'S 14"" The Works Pizza, Original Crust"|1.5
8004|28201|1800|MOTHER'S, Holiday Circus Animal Cookies|1.5
8003|28200|1800|MOTHER'S, Halloween Circus Animals Cookies|1.5
7696|23659|1300|"Beef, brisket, flat half, separable lean and fat, trimmed to 1/8"" fat, select, raw"|1.5
6699|21105|2100|Fast foods, fish sandwich, with tartar sauce|1.5
7999|28196|1800|MOTHER'S, Circus Animal Cookies|1.5
6251|19236|1900|Candies, HERSHEY'S MILK CHOCOLATE WITH ALMOND BITES|1.5
5348|17250|1700|"Lamb, domestic, shoulder, blade, separable lean and fat, trimmed to 1/8"" fat, choice, raw"|1.5
7997|28194|1800|MOTHER'S, 4th of July Circus Animal Cookies|1.5
1205|6002|600|Soup, black bean, canned, condensed|1.5
2551|10073|1000|Pork, fresh, shoulder, whole, separable lean only, cooked, roasted|1.5
5049|16534|1600|WORTHINGTON Stakelets, frozen, unprepared|1.5
8394|35166|3500|Fish, salmon, red, (sockeye), canned, smoked (Alaska Native)|1.5
5057|16551|1600|MORNINGSTAR FARMS Asian Veggie Patties, frozen, unprepared|1.5
3021|11274|1100|Mustard spinach, (tendergreen), raw (Brassica rapa (Perviridis Group))|1.5
6871|21363|2100|McDONALD'S, Deluxe Breakfast, with syrup and margarine|1.5
8619|42279|300|Babyfood, peas and brown rice|1.5
8667|43135|1600|Sandwich spread, meatless|1.5
5395|17298|1700|"Lamb, Australian, imported, fresh, leg, sirloin half, boneless, separable lean and fat, trimmed to 1/8"" fat, raw"|1.5
1873|8172|800|Cereals, farina, unenriched, dry|1.5
4969|16335|1600|Beans, kidney, red, mature seeds, canned, drained solids, rinsed in tap water|1.5
5385|17288|1700|"Lamb, Australian, imported, fresh, foreshank, separable lean only, trimmed to 1/8"" fat, raw"|1.5
2718|10888|1000|Pork, cured, ham and water product, slice, bone-in, separable lean only, unheated|1.5
4595|15114|1500|Fish, trout, mixed species, raw (Salmonidae)|1.5
6992|21515|2100|MORNINGSTAR FARMS Pizza, Baja Black Bean, single serve, frozen, unprepared|1.5
7887|28081|1800|KEEBLER, FUDGE SHOPPE, Caramel Filled Cookies|1.5
4876|16145|1600|Beans, kidney, red, mature seeds, canned, drained solids|1.5
4980|16353|1600|Broadbeans (fava beans), mature seeds, cooked, boiled, with salt|1.5
4791|16053|1600|Broadbeans (fava beans), mature seeds, cooked, boiled, without salt|1.5
1197|5743|500|Turkey, retail parts, thigh, meat and skin, cooked, roasted|1.5
7030|22901|2200|Tortellini, pasta with cheese filling, fresh-refrigerated, as purchased|1.5
1818|8071|800|Cereals ready-to-eat, KELLOGG, KELLOGG'S HONEY SMACKS|1.5
858|5036|500|Chicken, broilers or fryers, dark meat, meat and skin, cooked, fried, flour|1.5
8783|80200|1500|Frog legs, raw|1.5
7742|25052|2500|Snacks, granola bar, QUAKER, chewy, 90 Calorie Bar|1.5
2869|11089|1100|Broadbeans, immature seeds, cooked, boiled, drained, without salt|1.5
2575|10101|1000|Pork, fresh, variety meats and by-products, ears, frozen, cooked, simmered|1.5
3355|11738|1100|Broadbeans, immature seeds, cooked, boiled, drained, with salt (Vicia faba)|1.5
5160|17062|1700|Lamb, New Zealand, imported, frozen, composite of trimmed retail cuts, separable lean and fat, raw|1.49
6586|20137|2000|Quinoa, cooked (Chenopodium quinoa Willd.)|1.49
5170|17072|1700|Lamb, New Zealand, imported, leg chop/steak, bone-in, separable lean and fat, raw|1.49
4678|15201|1500|Fish, mackerel, Pacific and jack, mixed species, cooked, dry heat|1.49
4484|15003|1500|Fish, bass, fresh water, mixed species, raw (Percichthyidae and Centrarchidae)|1.49
5806|18310|1800|Pie, chocolate creme, commercially prepared|1.49
3798|13338|1300|Beef, variety meats and by-products, thymus, cooked, braised|1.49
958|5136|500|Chicken, capons, meat and skin, cooked, roasted|1.49
6090|19051|2500|Snacks, rice cracker brown rice, plain|1.49
5354|17256|1700|"Lamb, New Zealand, imported, frozen, foreshank, separable lean and fat, trimmed to 1/8"" fat, raw"|1.49
5815|18322|1800|Pie, mince, prepared from recipe|1.49
3128|11407|1100|Potatoes, french fried, cottage-cut, salt not added in processing, frozen, oven-heated|1.49
6408|19816|2500|Snacks, rice cakes, brown rice, plain, unsalted|1.49
2690|10860|1000|Pork, cured, bacon, cooked, baked|1.49
871|5049|500|Chicken, broilers or fryers, back, meat and skin, cooked, fried, batter|1.49
915|5093|500|Chicken, broilers or fryers, thigh, meat and skin, cooked, fried, flour|1.49
6985|21508|2100|WEND'YS, Crispy Chicken Sandwich|1.49
7732|25038|2500|Snacks, granola bars, soft, almond, confectioners coating|1.49
6517|20051|2000|Rice, white, medium-grain, enriched, cooked|1.49
1753|7958|700|Turkey sausage, fresh, cooked|1.49
7747|25059|2500|Snacks, brown rice chips|1.49
866|5044|500|Chicken, broilers or fryers, dark meat, meat only, cooked, fried|1.49
8600|42204|2500|Rice cake, cracker (include hain mini rice cakes)|1.49
3454|11840|1100|Potatoes, frozen, french fried, par fried, cottage-cut, prepared, heated in oven, with salt|1.49
4097|13954|1300|"Beef, bottom sirloin, tri-tip roast, separable lean and fat, trimmed to 0"" fat, all grades, raw"|1.49
8704|43327|1000|Pork, cured, ham, boneless, low sodium, extra lean (approximately 5% fat), roasted|1.48
5818|18325|1800|Pie, pecan, prepared from recipe|1.48
5387|17290|1700|"Lamb, Australian, imported, fresh, leg, whole (shank and sirloin), separable lean and fat, trimmed to 1/8"" fat, raw"|1.48
2600|10134|1000|Pork, cured, ham, boneless, extra lean (approximately 5% fat), roasted|1.48
5649|18120|1800|Cake, pound, commercially prepared, butter (includes fresh and frozen)|1.48
5648|18119|1800|Cake, pineapple upside-down, prepared from recipe|1.48
5391|17294|1700|"Lamb, Australian, imported, fresh, leg, shank half, separable lean and fat, trimmed to 1/8"" fat, raw"|1.48
4080|13929|1300|"Beef, top sirloin, steak, separable lean and fat, trimmed to 1/8"" fat, all grades, raw"|1.48
3038|11291|1100|Onions, spring or scallions (includes tops and bulb), raw (Allium cepa or Allium fistulosum)|1.48
6901|21406|2100|McDONALD'S, Premium Grilled Chicken Ranch BLT Sandwich|1.48
5149|17051|1700|"Lamb, domestic, shoulder, blade, separable lean and fat, trimmed to 1/4"" fat, choice, raw"|1.48
2379|9311|900|Roselle, raw (Hibiscus sabdariffa)|1.48
1243|6049|600|Soup, pea, green, canned, condensed|1.48
3593|11986|1100|Malabar spinach, cooked|1.48
6897|21402|2100|McDONALD'S, Premium Grilled Chicken Classic Sandwich|1.48
118|1130|100|Egg, whole, cooked, omelet|1.48
1684|7077|700|Smoked link sausage, pork and beef, nonfat dry milk added|1.47
2573|10099|1000|Pork, fresh, variety meats and by-products, chitterlings, cooked, simmered|1.47
7444|23364|1300|"Beef, round, eye of round steak, boneless, separable lean only, trimmed to 0"" fat, choice, raw"|1.47
1639|7025|700|Frankfurter, turkey|1.47
7441|23361|1300|"Beef, round, eye of round roast, boneless, separable lean only, trimmed to 0"" fat, choice, raw"|1.47
5496|17399|1700|Lamb, New Zealand, imported, square-cut shoulder, separable lean only, cooked, slow roasted|1.47
7411|23331|1300|"Beef, round, eye of round roast, boneless, separable lean and fat, trimmed to 0"" fat, choice, raw"|1.47
5553|17456|1700|"Lamb, Australian, imported, fresh, leg, hindshank, heel on, bone-in, separable lean and fat, trimmed to 1/8"" fat, raw"|1.47
4099|13956|1300|"Beef, bottom sirloin, tri-tip roast, separable lean and fat, trimmed to 0"" fat, choice, raw"|1.47
2982|11233|1100|Kale, raw (Brassica oleracea (Acephala Group))|1.47
6593|20310|2000|Noodles, egg, cooked, enriched, with added salt|1.47
4977|16347|1600|Beans, pinto, mature seeds, canned, solids and liquids, low sodium|1.47
4064|13913|1300|"Beef, loin, top loin, separable lean and fat, trimmed to 1/8"" fat, select, raw"|1.47
8442|35232|3500|Wocas, dried seeds, Oregon, yellow pond lily (Klamath) (Nuphar lutea)|1.47
3051|11304|1100|Peas, green, raw (Pisum sativum)|1.47
7414|23334|1300|"Beef, round, eye of round steak, boneless separable lean and fat, trimmed to 0"" fat, choice, raw"|1.47
6489|20019|2000|Corn flour, masa, unenriched, white|1.47
4060|13909|1300|"Beef, short loin, top loin, steak, separable lean and fat, trimmed to 1/8"" fat, all grades, raw"|1.47
6563|20110|2000|Noodles, egg, enriched, cooked|1.47
4782|16044|1600|Beans, pinto, mature seeds, canned, solids and liquids|1.47
3154|11439|1100|Sauerkraut, canned, solids and liquids|1.47
6994|21517|2100|Fast foods, crispy chicken in tortilla, with lettuce, cheese, and ranch sauce|1.47
5783|18281|1800|Muffins, corn, toaster-type|1.47
5230|17132|1700|Veal, shoulder, blade, separable lean only, cooked, braised|1.47
7000|21523|2100|McDONALD'S, RANCH SNACK WRAP, Crispy|1.47
8470|36019|3600|APPLEBEE'S, chili|1.46
6519|20053|2000|Rice, white, short-grain, enriched, cooked|1.46
8715|43366|500|Turkey, wing, smoked, cooked, with skin, bone removed|1.46
5488|17391|1700|Lamb, New Zealand, imported, hind-shank, separable lean only, raw|1.46
1556|6632|600|Sauce, hot chile, sriracha, CHA! BY TEXAS PETE|1.46
8488|36037|3600|Restaurant, family style, chili with meat and beans|1.46
919|5097|500|Chicken, broilers or fryers, thigh, meat only, cooked, fried|1.46
1015|5196|500|Turkey, all classes, wing, meat and skin, cooked, roasted|1.46
4727|15252|1500|USDA Commodity, salmon nuggets, cooked as purchased, unheated|1.46
8519|36408|3600|Restaurant, Latino, pupusas con frijoles (pupusas, bean)|1.46
4082|13931|1300|"Beef, top sirloin, steak, separable lean and fat, trimmed to 1/8"" fat, choice, raw"|1.46
3568|11959|1100|Arugula, raw (Eruca sativa)|1.46
7385|23305|1300|Beef, Australian, imported, grass-fed, loin, top loin steak/roast, boneless, separable lean and fat, raw|1.46
1760|7965|700|Pork sausage, link/patty, reduced fat, unprepared|1.46
5253|17155|1700|Veal, Australian, rib, rib roast, separable lean and fat, raw|1.46
2757|10929|1000|Pork, cured, ham, rump, bone-in, separable lean and fat, heated, roasted|1.46
7413|23333|1300|"Beef, round, eye of round steak, boneless, separable lean and fat, trimmed to 0"" fat, all grades, raw"|1.45
4671|15194|1500|Fish, mahimahi, cooked, dry heat|1.45
914|5092|500|Chicken, broilers or fryers, thigh, meat and skin, cooked, fried, batter|1.45
1004|5184|500|Turkey, dark meat from whole, meat and skin, cooked, roasted|1.45
4859|16123|1600|Soy sauce made from soy and wheat (shoyu)|1.45
7410|23330|1300|"Beef, round, eye of round roast, boneless, separable lean and fat, trimmed to 0"" fat, all grades, raw"|1.45
2561|10083|1000|Pork, fresh, shoulder, blade, boston (roasts), separable lean and fat, cooked, roasted|1.45
6850|21337|2100|McDONALD'S, Peanuts (for Sundaes)|1.45
6069|19026|2500|Snacks, granola bars, soft, coated, milk chocolate coating, peanut butter|1.45
6995|21518|2100|Fast foods, grilled chicken in tortilla, with lettuce, cheese, and ranch sauce|1.45
8575|42139|2500|Granola bar, soft, milk chocolate coated, peanut butter|1.45
8151|28349|1800|Cookies, oatmeal, reduced fat|1.45
7001|21524|2100|McDONALD'S, RANCH SNACK WRAP, Grilled|1.45
8652|43059|1900|Candies, chocolate covered, low sugar or low calorie|1.45
3710|12202|1200|Nuts, chestnuts, japanese, raw (Castanea crenata)|1.45
7443|23363|1300|"Beef, round, eye of round steak, boneless, separable lean only, trimmed to 0"" fat, all grades, raw"|1.45
5212|17114|1700|Veal, rib, separable lean only, cooked, braised|1.45
7440|23360|1300|"Beef, round, eye of round roast, boneless, separable lean only, trimmed to 0"" fat, all grades, raw"|1.45
5218|17120|1700|Veal, shoulder, whole (arm and blade), separable lean only, cooked, braised|1.45
8719|43378|1000|Pork, cured, bacon, cooked, broiled, pan-fried or roasted, reduced sodium|1.44
5683|18171|1800|Cookies, fortune|1.44
5005|16403|1600|Refried beans, canned, traditional, reduced sodium|1.44
857|5035|500|Chicken, broilers or fryers, dark meat, meat and skin, cooked, fried, batter|1.44
7743|25053|2500|Snacks, granola bar, GENERAL MILLS NATURE VALLEY, SWEET&SALTY NUT, peanut|1.44
5227|17129|1700|Veal, shoulder, blade, separable lean and fat, cooked, braised|1.44
1667|7059|700|Polish sausage, pork|1.44
5504|17407|1700|Lamb, New Zealand, imported, loin saddle, separable lean and fat, cooked, fast roasted|1.44
5239|17141|1700|Veal, cubed for stew (leg and shoulder), separable lean only, cooked, braised|1.44
4840|16103|1600|Refried beans, canned, traditional style (includes USDA commodity)|1.44
4674|15197|1500|Fish, herring, Pacific, cooked, dry heat|1.44
4492|15011|1500|Fish, catfish, channel, cooked, breaded and fried|1.43
8695|43283|500|Pheasant, cooked, total edible|1.43
2767|10940|1000|Pork, fresh, spareribs, separable lean and fat, cooked, roasted|1.43
1018|5216|500|Turkey, back, from whole bird, meat only, roasted|1.43
5360|17262|1700|"Lamb, new zealand, imported, frozen, rib, separable lean and fat, trimmed to 1/8"" fat, raw"|1.43
2670|10223|1000|Pork, fresh, loin, tenderloin, separable lean only, cooked, broiled|1.43
899|5077|500|Chicken, broilers or fryers, leg, meat and skin, cooked, fried, flour|1.43
7051|22937|2200|SPAGHETTIOS, SpaghettiOs in Meat Sauce|1.43
5377|17280|1700|"Lamb, Australian, imported, fresh, composite of trimmed retail cuts, separable lean and fat, trimmed to 1/8"" fat, raw"|1.43
7054|22940|2200|SPAGHETTIOS, SpaghettiOs with Meatballs|1.43
1195|5741|500|Turkey, thigh, from whole bird, meat only, roasted|1.43
7751|25064|2500|Snacks, potato chips, lightly salted|1.43
1293|6151|600|Sauce, plum, ready-to-serve|1.43
1008|5188|500|Turkey, from whole, dark meat, cooked, roasted|1.43
3596|11989|1100|Mushrooms, straw, canned, drained solids|1.43
7086|22975|2200|Chicken, nuggets, white meat, precooked, frozen, not reheated|1.43
4071|13920|1300|"Beef, tenderloin, steak, separable lean and fat, trimmed to 1/8"" fat, choice, raw"|1.43
838|5016|500|Chicken, broilers or fryers, skin only, cooked, fried, batter|1.43
5337|17239|1700|"Lamb, domestic, rib, separable lean and fat, trimmed to 1/8"" fat, choice, raw"|1.43
948|5126|500|Chicken, stewing, meat only, cooked, stewed|1.43
5642|18108|1800|Coffeecake, cinnamon with crumb topping, dry mix, prepared|1.43
8748|43507|700|Frankfurter, low sodium|1.43
5180|17082|1700|Lamb, New Zealand, imported, rack - partly frenched, separable lean only, raw|1.43
1689|7089|700|Sausage, Italian, pork, cooked|1.43
1690|7090|700|Luncheon sausage, pork and beef|1.43
6914|21422|2100|KFC, Popcorn Chicken|1.42
5215|17117|1700|Veal, shoulder, whole (arm and blade), separable lean and fat, cooked, braised|1.42
873|5051|500|Chicken, broilers or fryers, back, meat and skin, cooked, roasted|1.42
6831|21306|2100|Fast foods, griddle cake sandwich, sausage|1.42
6242|19226|1900|Frostings, chocolate, creamy, ready-to-eat|1.42
6844|21328|2100|McDONALD'S, Sausage McGRIDDLES|1.42
2762|10935|1000|Pork, cured, ham, shank, bone-in, separable lean and fat, heated, roasted|1.42
5417|17320|1700|"Lamb, Australian, imported, fresh, shoulder, whole (arm and blade), separable lean only,   trimmed to 1/8"" fat, raw"|1.42
921|5099|500|Chicken, broilers or fryers, thigh, meat only, cooked, stewed|1.42
2727|10899|1000|Pork, cured, ham, slice, bone-in, separable lean only, heated, pan-broil|1.42
4068|13917|1300|"Beef, tenderloin, steak, separable lean and fat, trimmed to 1/8"" fat, all grades, raw"|1.42
4351|14316|1400|Beverages, Malted drink mix, chocolate, with added nutrients, powder, prepared with whole milk|1.42
6898|21403|2100|McDONALD'S, Premium Crispy Chicken Classic Sandwich|1.42
4803|16065|1600|Cowpeas, common (blackeyes, crowder, southern), mature seeds, canned with pork|1.42
4074|13923|1300|"Beef, tenderloin, steak, separable lean and fat, trimmed to 1/8"" fat, select, raw"|1.42
1172|5717|500|Turkey, retail parts, thigh, meat only, raw|1.42
2557|10079|1000|Pork, fresh, shoulder, arm picnic, separable lean only, cooked, roasted|1.42
6902|21407|2100|McDONALD'S, Premium Crispy Chicken Ranch BLT Sandwich|1.42
5209|17111|1700|Veal, rib, separable lean and fat, cooked, braised|1.41
4537|15056|1500|Fish, mullet, striped, cooked, dry heat|1.41
955|5133|500|Chicken, capons, meat and skin and giblets and neck, raw|1.41
3646|12093|1200|Nuts, chestnuts, chinese, raw (Castanea mollissima)|1.41
547|3840|300|Infant formula, ABBOTT NUTRITION, SIMILAC, SPECIAL CARE, ADVANCE 24, with iron, ready-to-feed, with ARA and DHA|1.41
5224|17126|1700|Veal, shoulder, arm, separable lean only, cooked, braised|1.41
4521|15040|1500|Fish, herring, Atlantic, cooked, dry heat|1.41
8663|43130|1600|Frankfurter, meatless|1.41
5514|17417|1700|Lamb, New Zealand, imported, square-cut shoulder, separable lean and fat, cooked, slow roasted|1.41
4705|15228|1500|Crustaceans, spiny lobster, mixed species, cooked, moist heat|1.41
1274|6117|600|CAMPBELL'S Red and White, Bean with Bacon Soup, condensed|1.41
4725|15250|1500|Mollusks, conch, baked or broiled|1.41
6872|21364|2100|McDONALD'S, Hotcakes and Sausage|1.41
5450|17353|1700|Lamb, Australian, ground,  85% lean / 15% fat, raw|1.41
8530|36601|3600|Restaurant, Chinese, egg rolls, assorted|1.41
7718|25023|2500|Snacks, FRITOLAY, SUNCHIPS, Multigrain Snack, Harvest Cheddar flavor|1.41
2129|9011|900|Apples, dried, sulfured, uncooked|1.4
8784|83110|1500|Fish, mackerel, salted|1.4
5577|18019|1800|Bread, banana, prepared from recipe, made with margarine|1.4
6669|21023|2100|Fast foods, french toast with butter|1.4
8026|28224|1800|MURRAY, SUGAR FREE, Fudge Dipped Wafers|1.4
1699|7254|700|Turkey bacon, unprepared|1.4
5519|17422|1700|Lamb, New Zealand, imported, tunnel-boned leg, chump off, shank off, separable lean and fat, raw|1.4
8722|43384|700|Beef, bologna, reduced sodium|1.4
5494|17397|1700|Lamb, New Zealand, imported, rack - fully frenched, separable lean only, raw|1.4
1707|7909|700|Luncheon meat, pork and chicken, minced, canned, includes SPAM Lite|1.4
6663|21013|2100|Fast foods, croissant, with egg, cheese, and ham|1.4
5478|17381|1700|Lamb, New Zealand, imported, tunnel-boned leg, chump off, shank off, separable lean only, raw|1.4
1011|5192|500|Turkey, all classes, breast, meat and skin, cooked, roasted|1.4
8702|43325|1000|Pork, cured, ham, boneless, low sodium, extra lean and regular, roasted|1.4
3590|11983|1100|Pickles, chowchow, with cauliflower onion mustard, sweet|1.4
1658|7050|700|Mortadella, beef, pork|1.4
324|3012|300|Babyfood, meat, chicken, strained|1.4
2560|10082|1000|Pork, fresh, shoulder, blade, boston (steaks), separable lean and fat, cooked, broiled|1.4
7479|23401|1300|Beef, New Zealand, imported, brisket navel end, separable lean only, raw|1.4
4516|15035|1500|Fish, haddock, smoked|1.4
8788|93600|1500|Turtle, green, raw|1.4
5880|18413|1800|Bread, pita, white, unenriched|1.4
6381|19440|2500|Snacks, M&M MARS, KUDOS Whole Grain Bar, chocolate chip|1.4
5974|18639|1800|GEORGE WESTON BAKERIES, Thomas English Muffins|1.4
905|5083|500|Chicken, broilers or fryers, leg, meat only, cooked, stewed|1.4
6397|19800|2500|Snacks, corn cakes, very low sodium|1.4
4007|13856|1300|"Beef, rib, small end (ribs 10-12), separable lean and fat, trimmed to 1/8"" fat, select, raw"|1.4
4818|16081|1600|Mung beans, mature seeds, cooked, boiled, without salt|1.4
903|5081|500|Chicken, broilers or fryers, leg, meat only, cooked, fried|1.4
4993|16381|1600|Mung beans, mature seeds, cooked, boiled, with salt|1.4
6980|21501|2100|KASHI Pizza, Margherita, frozen, unprepared|1.4
6991|21514|2100|KASHI Pizza, Tikka Masala, single serve, frozen, unprepared|1.4
2878|11098|1100|Brussels sprouts, raw (Brassica oleracea (Gemmifera Group))|1.4
5912|18449|1800|Tortillas, ready-to-bake or -fry, corn, without added salt|1.4
5037|16521|1600|WORTHINGTON Vegetable Skallops, canned, unprepared|1.4
898|5076|500|Chicken, broilers or fryers, leg, meat and skin, cooked, fried, batter|1.4
6895|21400|2100|Fast foods, cheeseburger; double, regular patty; double decker bun with condiments and special sauce|1.4
5065|16561|1600|MORNINGSTAR FARMS Corn Dog Mini, frozen, unprepared|1.4
5068|16579|1600|GARDENBURGER Original, frozen, unprepared|1.4
5097|16619|1600|MORNINGSTAR FARMS Tuscan Greens & Beans, frozen, unprepared|1.4
4750|16010|1600|Beans, baked, canned, with pork and sweet sauce|1.4
6368|19419|2500|Snacks, corn cakes|1.4
6085|19046|2500|Snacks, potato chips, made from dried potatoes, sour-cream and onion-flavor|1.4
2632|10183|1000|Pork, cured, ham, boneless, extra lean and regular, roasted|1.4
4660|15183|1500|Fish, tuna, light, canned in oil, without salt, drained solids|1.39
5127|17029|1700|"Lamb, domestic, rib, separable lean and fat, trimmed to 1/4"" fat, choice, raw"|1.39
4001|13850|1300|"Beef, rib, small end (ribs 10-12), separable lean and fat, trimmed to 1/8"" fat, all grades, raw"|1.39
3460|11846|1100|Pumpkin, canned, with salt|1.39
5451|17354|1700|Lamb, New Zealand, imported, Intermuscular fat, cooked|1.39
4600|15119|1500|Fish, tuna, light, canned in oil, drained solids|1.39
5522|17425|1700|Veal, leg, top round, cap off, cutlet, boneless, cooked, grilled|1.39
5548|17451|1700|Lamb, Australian, imported, fresh, seam fat, cooked|1.39
2734|10906|1000|Pork, cured, ham and water product, slice, bone-in, separable lean and fat, unheated|1.39
3142|11424|1100|Pumpkin, canned, without salt|1.39
877|5055|500|Chicken, broilers or fryers, back, meat only, cooked, roasted|1.39
6173|19143|1900|Candies, MR. GOODBAR Chocolate Bar|1.39
2655|10208|1000|Pork, fresh, loin, country-style ribs, separable lean only, cooked, braised|1.39
7487|23409|1300|Beef, New Zealand, imported, eye round, separable lean only, raw|1.39
2668|10221|1000|Pork, fresh, loin, tenderloin, separable lean and fat, cooked, broiled|1.39
5165|17067|1700|Lamb, New Zealand, imported, frozen, composite of trimmed retail cuts, separable fat, cooked|1.39
7547|23469|1300|Beef, New Zealand, imported, striploin, separable lean and fat, raw|1.38
4004|13853|1300|"Beef, rib, small end (ribs 10-12), separable lean and fat, trimmed to 1/8"" fat, choice, raw"|1.38
830|5008|500|Chicken, broilers or fryers, meat and skin, cooked, fried, flour|1.38
3134|11413|1100|Potato flour|1.38
5221|17123|1700|Veal, shoulder, arm, separable lean and fat, cooked, braised|1.38
5491|17394|1700|Lamb, New Zealand, imported, netted shoulder, rolled, boneless, separable lean only, cooked, slow roasted|1.38
6940|21458|2100|POPEYES, Fried Chicken, Mild, Thigh, meat and skin with breading|1.38
6095|19058|2500|Snacks, tortilla chips, ranch-flavor|1.38
6941|21459|2100|POPEYES, Fried Chicken, Mild, Wing, meat and skin with breading|1.38
5383|17286|1700|"Lamb, Australian, imported, fresh, foreshank, separable lean and fat, trimmed to 1/8"" fat, raw"|1.38
331|3021|300|Babyfood, meat, meat sticks, junior|1.38
2604|10140|1000|Pork, cured, ham, regular (approximately 13% fat), canned, roasted|1.37
7445|23365|1300|"Beef, round, eye of round steak, boneless, separable lean only, trimmed to 0"" fat, select, raw"|1.37
931|5109|500|Chicken, roasting, meat and skin and giblets and neck, raw|1.37
896|5074|500|Chicken, broilers or fryers, drumstick, meat only, cooked, stewed|1.37
917|5095|500|Chicken, broilers or fryers, thigh, meat and skin, cooked, stewed|1.37
6899|21404|2100|McDONALD'S, Premium Grilled Chicken Club Sandwich|1.37
2742|10914|1000|Pork, cured, ham -- water added, shank, bone-in, separable lean and fat, heated, roasted|1.37
2177|9064|900|Cherries, sour, red, canned, water pack, solids and liquids (includes USDA commodity red tart cherries, canned)|1.37
829|5007|500|Chicken, broilers or fryers, meat and skin, cooked, fried, batter|1.37
1565|6731|600|Soup, bean with bacon, condensed, single brand|1.37
6012|18964|1800|Cinnamon buns, frosted (includes honey buns)|1.37
7412|23332|1300|"Beef, round, eye of round roast, boneless, separable lean and fat, trimmed to 0"" fat, select, raw"|1.37
7442|23362|1300|"Beef, round, eye of round roast, boneless, separable lean only, trimmed to 0"" fat, select, raw"|1.37
7535|23457|1300|Beef, New Zealand, imported, eye round, separable lean and fat, raw|1.37
7787|27048|600|Sauce, steak, tomato based|1.37
946|5124|500|Chicken, stewing, meat and skin, cooked, stewed|1.37
8703|43326|1000|Pork, cured, ham, low sodium, lean and fat, cooked|1.37
6942|21461|2100|Fast foods, grilled chicken, bacon and tomato club sandwich, with cheese, lettuce, and mayonnaise|1.37
5240|17142|1700|Veal, ground, raw|1.37
7415|23335|1300|"Beef, round, eye of round steak, boneless, separable lean and fat, trimmed to 0"" fat, select, raw"|1.37
612|3968|300|Toddler formula, MEAD JOHNSON, ENFAGROW PREMIUM (formerly ENFAMIL, LIPIL, NEXT STEP), ready-to-feed|1.37
5168|17070|1700|Lamb, New Zealand, imported, fore-shank, separable lean only, raw|1.37
5653|18128|1800|Cake, snack cakes, creme-filled, sponge|1.36
5877|18407|1800|Bagels, plain, unenriched, with calcium propionate (includes onion, poppy, sesame)|1.36
6082|19042|2500|Snacks, potato chips, barbecue-flavor|1.36
5517|17420|1700|Lamb, New Zealand, imported, rack - fully frenched, separable lean and fat, raw|1.36
