|NDB_No|FdGrp_Cd|Long_Desc|SE
7802|27063|600|Sauce, enchilada, red, mild, ready to serve|0.4
2856|11056|1100|Beans, snap, green, canned, regular pack, drained solids|0.4
2305|9228|900|Papaya, canned, heavy syrup, drained|0.4
2219|9109|900|Gooseberries, canned, light syrup pack, solids and liquids|0.4
4319|14262|1400|Beverages, citrus fruit juice drink, frozen concentrate|0.4
8176|28375|1800|VAN'S, Gluten Free, Totally Original Waffles|0.4
8170|28369|1800|SCHAR, Gluten-Free, Wheat-Free, Classic White Bread|0.4
2913|11143|1100|Celery, raw (Apium graveolens)|0.4
2912|11142|1100|Celeriac, cooked, boiled, drained, without salt|0.4
8169|28368|1800|SCHAR, Gluten-Free, Classic White Rolls|0.4
8149|28347|1800|Pancakes, gluten-free, frozen, ready-to-heat|0.4
8148|28346|1800|Waffles, gluten-free, frozen, ready-to-heat|0.4
8143|28341|1800|Rolls, gluten-free, white, made with rice flour, rice starch, and corn starch|0.4
8139|28337|1800|Bread, gluten-free, white, made with rice flour, corn starch, and/or tapioca|0.4
2903|11128|1100|Carrots, canned, regular pack, drained solids|0.4
2902|11126|1100|Carrots, canned, regular pack, solids and liquids|0.4
2254|9150|900|Lemons, raw, without peel (Citrus limon)|0.4
2259|9159|900|Limes, raw (Citrus latifolia)|0.4
2897|11120|1100|Cabbage, chinese (pe-tsai), cooked, boiled, drained, without salt|0.4
2894|11117|1100|Cabbage, chinese (pak-choi), cooked, boiled, drained, without salt|0.4
4339|14292|1400|Lemonade, frozen concentrate, white|0.4
2273|9181|900|Melons, cantaloupe, raw (Cucumis melo)|0.4
6726|21144|2100|CHICK-FIL-A, hash browns|0.4
2274|9183|900|Melons, casaba, raw (Cucumis melo)|0.4
3444|11828|1100|Potatoes, baked, flesh and skin, with salt|0.4
2294|9213|900|Orange juice, frozen concentrate, unsweetened, undiluted, with added calcium|0.4
2295|9214|900|Orange juice, frozen concentrate, unsweetened, undiluted|0.4
6360|19410|2500|Snack, potato chips, made from dried potatoes, plain|0.4
2300|9219|900|Tangerines, (mandarin oranges), canned, juice pack|0.4
2301|9220|900|Tangerines, (mandarin oranges), canned, light syrup pack|0.4
7806|27067|600|Sauce, OLD EL PASO, enchilada, red, mild, ready to serve|0.4
2859|11061|1100|Beans, snap, green, frozen, cooked, boiled, drained without salt|0.4
3389|11772|1100|Corn, sweet, yellow, canned, cream style, no salt added|0.4
3034|11287|1100|Onions, frozen, chopped, unprepared|0.4
3419|11803|1100|Okra, cooked, boiled, drained, with salt|0.4
3348|11731|1100|Beans, snap, green, frozen, cooked, boiled, drained, with salt|0.4
480|3235|300|Babyfood, dessert, fruit dessert, without ascorbic acid, strained|0.4
481|3236|300|Babyfood, dessert, fruit dessert, without ascorbic acid, junior|0.4
3291|11644|1100|Squash, winter, all varieties, cooked, baked, without salt|0.4
4125|14006|1400|Alcoholic beverage, beer, light|0.4
3290|11643|1100|Squash, winter, all varieties, raw (Cucurbita spp.)|0.4
482|3238|300|Babyfood, dessert, tropical fruit, junior|0.4
8637|43007|300|Babyfood, fruit, tutti frutti, junior|0.4
8636|43006|300|Babyfood, fruit, tutti frutti, strained|0.4
3341|11724|1100|Beans, snap, yellow, cooked, boiled, drained, without salt|0.4
6331|19360|1900|Syrups, table blends, pancake, with 2% maple|0.4
375|3093|300|Babyfood, green beans, dices, toddler|0.4
3346|11729|1100|Beans, snap, green, canned, no salt added, drained solids|0.4
641|4018|400|Salad dressing, mayonnaise type, regular, with salt|0.4
407|3141|300|Babyfood, pears, dices, toddler|0.4
3240|11566|1100|Turnips, frozen, unprepared|0.4
3586|11979|1100|Peppers, jalapeno, raw (Capsicum anuum)|0.4
3584|11977|1100|Peppers, serrano, raw (Capsicum anuum)|0.4
3578|11970|1100|Cabbage, napa, cooked (Brassica oleracea)|0.4
6885|21387|2100|BURGER KING, Hash Brown Rounds|0.4
3226|11537|1100|Tomatoes, red, ripe, canned, with green chilies|0.4
3329|11712|1100|Bamboo shoots, cooked, boiled, drained, with salt|0.4
8708|43344|1900|Jams, preserves, marmalade, reduced sugar|0.4
422|3160|300|Babyfood, fruit, guava and papaya with tapioca, strained|0.4
3517|11906|1100|Corn, sweet, white, canned, cream style, regular pack|0.4
427|3165|300|Babyfood, fruit, apple and blueberry, junior|0.4
426|3164|300|Babyfood, fruit, apple and blueberry, strained|0.4
3310|11674|1100|Potatoes, baked, flesh and skin, without salt|0.4
3311|11675|1100|Potatoes, microwaved, cooked in skin, flesh and skin, without salt|0.4
424|3162|300|Babyfood, fruit, papaya and applesauce with tapioca, strained|0.4
423|3161|300|Babyfood, peaches, dices, toddler|0.4
4145|14034|1400|Alcoholic beverage, creme de menthe, 72 proof|0.4
3316|11695|1100|Tomatoes, orange, raw (Solanum lycopersicum)|0.4
6300|19314|1900|Pie fillings, canned, cherry|0.4
3186|11484|1100|Squash, winter, acorn, cooked, boiled, mashed, without salt|0.4
421|3159|300|Babyfood, fruit, pears and pineapple, junior|0.4
3317|11696|1100|Tomatoes, yellow, raw (Solanum lycopersicum)|0.4
420|3158|300|Babyfood, fruit, pears and pineapple, strained|0.4
4140|14028|1400|Beverages, Whiskey sour mix, bottled|0.4
3183|11481|1100|Squash, summer, zucchini, italian style, canned|0.4
3221|11527|1100|Tomatoes, green, raw (Solanum lycopersicum)|0.4
412|3147|300|Babyfood, fruit, applesauce with banana, junior|0.4
3347|11730|1100|Beans, snap, yellow, frozen, all styles, unprepared|0.4
3342|11725|1100|Beans, snap, yellow, cooked, boiled, drained, with salt|0.4
3349|11732|1100|Beans, snap, yellow, frozen, cooked, boiled, drained, without salt|0.4
3142|11424|1100|Pumpkin, canned, without salt|0.4
6284|19294|1900|Fruit butters, apple|0.4
8734|43408|300|Babyfood, juice, pear|0.4
2415|9410|900|Apple juice, frozen concentrate, unsweetened, undiluted, with added ascorbic acid|0.4
3128|11407|1100|Potatoes, french fried, cottage-cut, salt not added in processing, frozen, oven-heated|0.4
3350|11733|1100|Beans, snap, yellow, frozen, cooked, boiled, drained, with salt|0.4
3284|11632|1100|Peppers, jalapeno, canned, solids and liquids|0.4
3122|11399|1100|Potato puffs, frozen, oven-heated|0.4
3252|11583|1100|Vegetables, mixed, frozen, unprepared|0.4
3126|11403|1100|Potatoes, french fried, all types, salt added in processing, frozen, home-prepared, oven heated|0.4
400|3133|300|Babyfood, fruit, pears, junior|0.4
8552|36624|3600|Restaurant, Chinese, vegetable chow mein, without meat or noodles|0.4
3132|11411|1100|Potatoes, french fried, steak fries, salt added in processing, frozen, as purchased|0.4
402|3135|300|Babyfood, fruit, plums with tapioca, without ascorbic acid, junior|0.4
6072|19030|1900|Syrup, fruit flavored|0.4
6082|19042|2500|Snacks, potato chips, barbecue-flavor|0.4
6288|19300|1900|Jellies|0.4
406|3140|300|Babyfood, fruit dessert, mango with tapioca|0.4
6861|21349|2100|McDONALD'S, NEWMAN'S OWN Ranch Dressing|0.4
399|3132|300|Babyfood, fruit, pears, strained|0.4
6840|21319|2100|McDONALD'S, Hash Brown|0.4
401|3134|300|Babyfood, fruit, plums with tapioca, without ascorbic acid, strained|0.4
8701|43312|1100|Vegetables, mixed (corn, lima beans, peas, green beans, carrots) canned, no salt added|0.3
3447|11831|1100|Potatoes, boiled, cooked in skin, flesh, with salt|0.3
417|3154|300|Babyfood, fruit and vegetable, apple and sweet potato|0.3
3448|11832|1100|Potatoes, boiled, cooked in skin, skin, with salt|0.3
2887|11109|1100|Cabbage, raw (Brassica oleracea (Capitata Group))|0.3
3445|11829|1100|Potatoes, baked, flesh, with salt|0.3
2385|9317|900|Strawberries, canned, heavy syrup pack, solids and liquids|0.3
416|3153|300|Babyfood, fruit, apple and raspberry, junior|0.3
4342|14296|1400|Beverages, lemonade-flavor drink, powder|0.3
395|3128|300|Babyfood, fruit, apricot with tapioca, junior|0.3
3449|11833|1100|Potatoes, boiled, cooked without skin, flesh, with salt|0.3
415|3152|300|Babyfood, fruit, apple and raspberry, strained|0.3
389|3118|300|Babyfood, fruit, apricot with tapioca, strained|0.3
6998|21521|2100|Fast foods, strawberry banana smoothie made with ice and low-fat yogurt|0.3
2441|9442|900|Pomegranate juice, bottled|0.3
388|3117|300|Babyfood, fruit, applesauce, junior|0.3
387|3116|300|Babyfood, fruit, applesauce, strained|0.3
2408|9401|900|Applesauce, canned, unsweetened, with added ascorbic acid|0.3
2233|9125|900|Grapefruit juice, white, frozen concentrate, unsweetened, undiluted|0.3
2409|9402|900|Applesauce, canned, sweetened, with salt|0.3
429|3167|300|Babyfood, apple-banana juice|0.3
430|3168|300|Babyfood, juice, apple and peach|0.3
432|3170|300|Babyfood, juice, apple and plum|0.3
2221|9111|900|Grapefruit, raw, pink and red and white, all areas (Citrus paradisi)|0.3
3527|11916|1100|Peppers, sweet, red, canned, solids and liquids|0.3
411|3145|300|Babyfood, fruit, applesauce and cherries, junior|0.3
414|3151|300|Babyfood, fruit, applesauce and pineapple, junior|0.3
2312|9238|900|Peaches, canned, juice pack, solids and liquids|0.3
3583|11976|1100|Pepper, banana, raw (Capsicum anuum)|0.3
4391|14424|1400|Beverages, Orange-flavor drink, breakfast type, with pulp, frozen concentrate. Not manufactured anymore.|0.3
3587|11980|1100|Peppers, chili, green, canned|0.3
3436|11820|1100|Peppers, hot chili, red, canned, excluding seeds, solids and liquids|0.3
3588|11981|1100|Peppers, hungarian, raw|0.3
3251|11581|1100|Vegetables, mixed, canned, drained solids|0.3
386|3115|300|Babyfood, apples, dices, toddler|0.3
3438|11822|1100|Peppers, sweet, green, cooked, boiled, drained, with salt|0.3
2317|9243|900|Peaches, spiced, canned, heavy syrup pack, solids and liquids|0.3
2919|11150|1100|Chayote, fruit, cooked, boiled, drained, without salt|0.3
2315|9241|900|Peaches, canned, heavy syrup pack, solids and liquids|0.3
2314|9240|900|Peaches, canned, light syrup pack, solids and liquids|0.3
3253|11584|1100|Vegetables, mixed, frozen, cooked, boiled, drained, without salt|0.3
408|3142|300|Babyfood, fruit, applesauce and apricots, strained|0.3
2311|9237|900|Peaches, canned, water pack, solids and liquids|0.3
413|3150|300|Babyfood, fruit, applesauce and pineapple, strained|0.3
3439|11823|1100|Peppers, sweet, red, cooked, boiled, drained, without salt|0.3
3568|11959|1100|Arugula, raw (Eruca sativa)|0.3
4417|14534|1400|Alcoholic beverage, liqueur, coffee, 63 proof|0.3
409|3143|300|Babyfood, fruit, applesauce and apricots, junior|0.3
2306|9229|900|Papaya nectar, canned|0.3
410|3144|300|Babyfood, fruit, applesauce and cherries, strained|0.3
2363|9291|900|Plums, dried (prunes), uncooked|0.3
3562|11953|1100|Squash, zucchini, baby, raw (Cucurbita spp.)|0.3
6298|19312|1900|Pie fillings, apple, canned|0.3
3440|11824|1100|Peppers, sweet, red, cooked, boiled, drained, with salt|0.3
2462|9513|900|Fruit juice smoothie, ODWALLA, ORIGINAL SUPERFOOD|0.3
3398|11782|1100|Dandelion greens, cooked, boiled, drained, with salt|0.3
2375|9306|900|Raspberries, frozen, red, sweetened|0.3
3560|11951|1100|Peppers, sweet, yellow, raw (Capsicum annuum)|0.3
433|3171|300|Babyfood, juice, apple and prune|0.3
3193|11491|1100|Squash, winter, hubbard, cooked, boiled, mashed, without salt|0.3
2124|9006|900|Apples, raw, without skin, cooked, microwave|0.3
2130|9012|900|Apples, dried, sulfured, stewed, without added sugar|0.3
3070|11335|1100|Peppers, sweet, green, canned, solids and liquids|0.3
4299|14239|1400|Alcoholic beverage, malt beer, hard lemonade|0.3
3069|11334|1100|Peppers, sweet, green, cooked, boiled, drained, without salt|0.3
2163|9046|900|Blackberries, canned, heavy syrup, solids and liquids|0.3
3127|11406|1100|Potatoes, french fried, cottage-cut, salt not added in processing, frozen, as purchased|0.3
2161|9043|900|Blackberry juice, canned|0.3
3176|11474|1100|Squash, summer, crookneck and straightneck, frozen, cooked, boiled, drained, without salt|0.3
6193|19164|1900|Candies, SPECIAL DARK Chocolate Bar|0.3
3484|11870|1100|Squash, winter, spaghetti, cooked, boiled, drained, or baked, with salt|0.3
2138|9020|900|Applesauce, canned, sweetened, without salt (includes USDA commodity)|0.3
2137|9019|900|Applesauce, canned, unsweetened, without added ascorbic acid (includes USDA commodity)|0.3
3067|11329|1100|Peppers, hot chili, green, canned, pods, excluding seeds, solids and liquids|0.3
6858|21346|2100|McDONALD'S, NEWMAN'S OWN Cobb Dressing|0.3
3483|11869|1100|Squash, winter, hubbard, cooked, boiled, mashed, with salt|0.3
2961|11209|1100|Eggplant, raw (Solanum melongena)|0.3
2126|9008|900|Apples, canned, sweetened, sliced, drained, heated|0.3
2125|9007|900|Apples, canned, sweetened, sliced, drained, unheated|0.3
292|2044|200|Basil, fresh (Ocimum basilicum)|0.3
2123|9005|900|Apples, raw, without skin, cooked, boiled|0.3
491|3279|300|Babyfood, dinner, mixed vegetable, junior|0.3
1231|6037|600|Soup, lentil with ham, canned, ready-to-serve|0.3
3473|11859|1100|Squash, summer, crookneck and straightneck, frozen, cooked, boiled, drained, with salt|0.3
1489|6476|600|Soup, beef broth, cubed, prepared with water|0.3
1488|6475|600|Soup, beef broth or bouillon, powder, prepared with water|0.3
3140|11422|1100|Pumpkin, raw (Cucurbita spp.)|0.3
1318|6193|600|Split pea with ham soup, canned, reduced sodium, prepared with water or ready-to-serve|0.3
8431|35205|3500|Stinging Nettles, blanched (Northern Plains Indians)|0.3
8597|42193|400|Salad Dressing, mayonnaise-like, fat-free|0.3
1317|6192|600|Split pea soup, canned, reduced sodium, prepared with water or ready-to serve|0.3
3032|11285|1100|Onions, canned, solids and liquids|0.3
3505|11894|1100|Vegetables, mixed, frozen, cooked, boiled, drained, with salt|0.3
3194|11492|1100|Squash, winter, spaghetti, raw (Cucurbita spp.)|0.3
3195|11493|1100|Squash, winter, spaghetti, cooked, boiled, drained, or baked, without salt|0.3
3094|11367|1100|Potatoes, boiled, cooked without skin, flesh, without salt|0.3
8231|31035|1100|Vegetable juice, BOLTHOUSE FARMS, DAILY GREENS|0.3
3093|11366|1100|Potatoes, boiled, cooked in skin, skin, without salt|0.3
3092|11365|1100|Potatoes, boiled, cooked in skin, flesh, without salt|0.3
3384|11767|1100|Chrysanthemum, garland, cooked, boiled, drained, with salt|0.3
3115|11392|1100|Potatoes, hash brown, frozen, with butter sauce, unprepared|0.3
3383|11766|1100|Chayote, fruit, cooked, boiled, drained, with salt|0.3
3090|11363|1100|Potatoes, baked, flesh, without salt|0.3
3089|11362|1100|Potatoes, raw, skin (Solanum tuberosum)|0.3
3116|11393|1100|Potatoes, hash brown, frozen, with butter sauce, prepared|0.3
374|3092|300|Babyfood, vegetables, green beans, junior|0.3
3319|11698|1100|Chrysanthemum leaves, raw (Chrysanthemum coronarium)|0.3
2925|11158|1100|Chrysanthemum, garland, cooked, boiled, drained, without salt|0.3
2957|11205|1100|Cucumber, with peel, raw (Cucumis sativus)|0.3
335|3025|300|Babyfood, GERBER, 3rd Foods, apple, mango and kiwi|0.3
3081|11354|1100|Potatoes, white, flesh and skin, raw (Solanum tuberosum)|0.3
3121|11398|1100|Potato puffs, frozen, unprepared|0.3
3123|11400|1100|Potatoes, frozen, whole, unprepared|0.3
2960|11208|1100|Dandelion greens, cooked, boiled, drained, without salt|0.3
2921|11152|1100|Chicory greens, raw (Cichorium intybus)|0.3
3113|11390|1100|Potatoes, hash brown, frozen, plain, unprepared|0.3
687|4520|400|Fat, mutton tallow|0.2
2410|9403|900|Apricot nectar, canned, with added ascorbic acid|0.2
697|4542|400|Fat, chicken|0.2
6269|19263|1900|Frozen novelties, fruit and juice bars|0.2
2412|9407|900|Peach nectar, canned, with added ascorbic acid|0.2
5858|18373|1800|Leavening agents, cream of tartar|0.2
5854|18369|1800|Leavening agents, baking powder, double-acting, sodium aluminum sulfate|0.2
5855|18370|1800|Leavening agents, baking powder, double-acting, straight phosphate|0.2
5857|18372|1800|Leavening agents, baking soda|0.2
714|4575|400|Fat, turkey|0.2
6281|19283|1900|Frozen novelties, ice type, pop|0.2
2393|9328|900|Maraschino cherries, canned, drained|0.2
2373|9302|900|Raspberries, raw (Rubus spp.)|0.2
5856|18371|1800|Leavening agents, baking powder, low-sodium|0.2
713|4574|400|Fat, duck|0.2
8674|43155|1400|Alcoholic beverage, wine, light|0.2
2332|9259|900|Pears, dried, sulfured, uncooked|0.2
2252|9148|900|Kiwifruit, green, raw (Actinidia deliciosa)|0.2
4457|14625|1400|Beverages, Energy drink, AMP|0.2
4473|14641|1400|Beverages, Energy drink, VAULT Zero, sugar-free, citrus flavor|0.2
4472|14640|1400|Beverages, Energy drink, VAULT, citrus flavor|0.2
2200|9089|900|Figs, raw (Ficus carica)|0.2
4458|14626|1400|Beverages, Energy drink, FULL THROTTLE|0.2
2202|9091|900|Figs, canned, light syrup pack, solids and liquids|0.2
2203|9092|900|Figs, canned, heavy syrup pack, solids and liquids|0.2
2206|9095|900|Figs, dried, stewed|0.2
634|4002|400|Lard|0.2
4460|14628|1400|Beverages, Energy drink, AMP, sugar free|0.2
6234|19217|1900|Frozen novelties, ice type, fruit, no sugar added|0.2
6253|19239|1900|Candies, REESE'S NUTRAGEOUS Candy Bar|0.2
715|4576|400|Fat, goose|0.2
4462|14630|1400|Beverages, Energy drink, ROCKSTAR, sugar free|0.2
4468|14636|1400|Beverages, fruit juice drink, reduced sugar, with vitamin E added|0.2
381|3105|300|Babyfood, vegetables, squash, junior|0.2
469|3220|300|Babyfood, dessert, dutch apple, strained|0.2
2265|9167|900|Loganberries, frozen (Rubus ursinus var. loganobaccus)|0.2
4437|14602|1400|Alcoholic Beverage, wine, table, red, Merlot|0.2
380|3104|300|Babyfood, vegetables, squash, strained|0.2
2321|9247|900|Peaches, dried, sulfured, stewed, without added sugar|0.2
8419|35193|3500|Agave, cooked (Southwest)|0.2
633|4001|400|Fat, beef tallow|0.2
1495|6494|600|Soup, onion, dry, mix, prepared with water|0.2
1584|6961|600|Sauce, peppers, hot, chili, mature red, canned|0.2
1585|6962|600|Sauce, chili, peppers, hot, immature green, canned|0.2
8673|43154|1400|Alcoholic beverage, wine, cooking|0.2
2132|9014|900|Apples, frozen, unsweetened, unheated|0.2
2133|9015|900|Apples, frozen, unsweetened, heated|0.2
378|3099|300|Babyfood, vegetables, carrots, strained|0.2
379|3100|300|Babyfood, vegetables, carrots, junior|0.2
2169|9055|900|Blueberries, frozen, sweetened|0.2
4430|14553|1400|Beverages, Wine, non-alcoholic|0.2
470|3221|300|Babyfood, dessert, dutch apple, junior|0.2
2171|9057|900|Boysenberries, frozen, unsweetened|0.2
720|4585|400|Margarine-like, margarine-butter blend, soybean oil and butter|0.2
2324|9251|900|Peach nectar, canned, without added ascorbic acid|0.2
3178|11476|1100|Squash, summer, scallop, cooked, boiled, drained, without salt|0.2
3474|11860|1100|Squash, summer, scallop, cooked, boiled, drained, with salt|0.2
3323|11703|1100|Artichokes, (globe or french), frozen, cooked, boiled, drained, with salt|0.2
3490|11876|1100|Sweet potato, cooked, boiled, without skin, with salt|0.2
2832|11025|1100|Balsam-pear (bitter gourd), pods, cooked, boiled, drained, without salt|0.2
3328|11711|1100|Balsam-pear (bitter gourd), pods, cooked, boiled, drained, with salt|0.2
2831|11024|1100|Balsam-pear (bitter gourd), pods, raw (Momordica charantia)|0.2
3175|11473|1100|Squash, summer, crookneck and straightneck, frozen, unprepared|0.2
3174|11471|1100|Squash, summer, crookneck and straightneck, canned, drained, solid, without salt|0.2
2822|11010|1100|Artichokes, (globe or french), frozen, cooked, boiled, drained, without salt|0.2
3259|11593|1100|Waxgourd, (chinese preserving melon), raw (Benincasa hispida)|0.2
3489|11875|1100|Sweet potato, cooked, baked in skin, flesh, with salt|0.2
3340|11723|1100|Beans, snap, green, cooked, boiled, drained, with salt|0.2
3343|11726|1100|Beans, snap, green, canned, no salt added, solids and liquids|0.2
3173|11468|1100|Squash, summer, crookneck and straightneck, cooked, boiled, drained, without salt|0.2
2821|11009|1100|Artichokes, (globe or french), frozen, unprepared|0.2
3344|11727|1100|Beans, snap, yellow, canned, regular pack, solids and liquids|0.2
2820|11008|1100|Artichokes, (globe or french), cooked, boiled, drained, without salt|0.2
2819|11007|1100|Artichokes, (globe or french), raw (Cynara scolymus)|0.2
3345|11728|1100|Beans, snap, yellow, canned, no salt added, solids and liquids|0.2
3476|11862|1100|Squash, summer, zucchini, includes skin, frozen, cooked, boiled, drained, with salt|0.2
2476|9530|900|Fruit juice smoothie, ODWALLA, strawberry banana|0.2
2898|11122|1100|Cardoon, raw (Cynara cardunculus)|0.2
3177|11475|1100|Squash, summer, scallop, raw (Cucurbita spp.)|0.2
3260|11594|1100|Waxgourd, (chinese preserving melon), cooked, boiled, drained, without salt|0.2
3322|11702|1100|Artichokes, (globe or french), cooked, boiled, drained, with salt|0.2
3288|11641|1100|Squash, summer, all varieties, raw (Cucurbita spp.)|0.2
3552|11943|1100|Pimento, canned|0.2
4159|14054|1400|Beverages, almond milk, chocolate, ready-to-drink|0.2
2972|11221|1100|Gourd, dishcloth (towelgourd), cooked, boiled, drained, without salt|0.2
2971|11220|1100|Gourd, dishcloth (towelgourd), raw (Luffa aegyptiaca)|0.2
2970|11219|1100|Gourd, white-flowered (calabash), cooked, boiled, drained, without salt|0.2
2969|11218|1100|Gourd, white-flowered (calabash), raw (Lagenaria siceraria)|0.2
4284|14219|1400|Beverages, coffee, instant, decaffeinated, prepared with water|0.2
2966|11214|1100|Escarole, cooked, boiled, drained, no salt added|0.2
2965|11213|1100|Endive, raw (Cichorium endivia)|0.2
2857|11058|1100|Beans, snap, canned, all styles, seasoned, solids and liquids|0.2
3506|11895|1100|Waxgourd, (chinese preserving melon), cooked, boiled, drained, with salt|0.2
3289|11642|1100|Squash, summer, all varieties, cooked, boiled, drained, without salt|0.2
3530|11919|1100|Peppers, sweet, red, frozen, chopped, boiled, drained, with salt|0.2
2854|11053|1100|Beans, snap, green, cooked, boiled, drained, without salt|0.2
3182|11480|1100|Squash, summer, zucchini, includes skin, frozen, cooked, boiled, drained, without salt|0.2
3181|11479|1100|Squash, summer, zucchini, includes skin, frozen, unprepared|0.2
3180|11478|1100|Squash, summer, zucchini, includes skin, cooked, boiled, drained, without salt|0.2
3179|11477|1100|Squash, summer, zucchini, includes skin, raw|0.2
3529|11918|1100|Peppers, sweet, red, frozen, chopped, boiled, drained, without salt|0.2
3528|11917|1100|Peppers, sweet, red, frozen, chopped, unprepared|0.2
3475|11861|1100|Squash, summer, zucchini, includes skin, cooked, boiled, drained, with salt|0.2
3172|11467|1100|Squash, summer, crookneck and straightneck, raw (Cucurbita spp.)|0.2
3249|11578|1100|Vegetable juice cocktail, canned|0.2
3455|11841|1100|Potatoes, french fried, all types, salt not added in processing, frozen, oven-heated|0.2
3207|11508|1100|Sweet potato, cooked, baked in skin, flesh, without salt|0.2
3239|11565|1100|Turnips, cooked, boiled, drained, without salt|0.2
3453|11837|1100|Potatoes, frozen, whole, cooked, boiled, drained, with salt|0.2
3387|11770|1100|Corn, sweet, yellow, cooked, boiled, drained, with salt|0.2
3441|11825|1100|Peppers, sweet, green, frozen, chopped, cooked, boiled, drained, with salt|0.2
3796|13335|1300|Beef, variety meats and by-products, suet, raw|0.2
4235|14156|1400|Beverages, Energy drink, RED BULL, sugar free, with added caffeine, niacin, pantothenic acid, vitamins B6 and B12|0.2
3400|11784|1100|Gourd, white-flowered (calabash), cooked, boiled, drained, with salt|0.2
4233|14154|1400|Beverages, Energy drink, RED BULL|0.2
3232|11551|1100|Tomato products, canned, sauce, with mushrooms|0.2
3208|11510|1100|Sweet potato, cooked, boiled, without skin|0.2
4311|14253|1400|Alcoholic beverages, wine, rose|0.2
3071|11337|1100|Peppers, sweet, green, frozen, chopped, unprepared|0.2
4141|14029|1400|Alcoholic beverage, whiskey sour, prepared from item 14028|0.2
3401|11785|1100|Gourd, dishcloth (towelgourd), cooked, boiled, drained, with salt|0.2
3072|11338|1100|Peppers, sweet, green, frozen, chopped, boiled, drained, without salt|0.2
2932|11168|1100|Corn, sweet, yellow, cooked, boiled, drained, without salt|0.2
2920|11151|1100|Chicory, witloof, raw (Cichorium intybus)|0.2
3141|11423|1100|Pumpkin, cooked, boiled, drained, without salt|0.2
4191|14096|1400|Alcoholic beverage, wine, table, red|0.2
2918|11149|1100|Chayote, fruit, raw (Sechium edule)|0.2
3250|11579|1100|Vegetables, mixed, canned, solids and liquids|0.2
4322|14267|1400|Beverages, Fruit punch drink, with added nutrients, canned|0.2
2467|9518|900|Raspberries, frozen, unsweetened|0.2
4178|14079|1400|Beverages, yellow green colored citrus soft drink with caffeine|0.2
4182|14084|1400|Alcoholic beverage, wine, table, all|0.2
6859|21347|2100|McDONALD'S, NEWMAN'S OWN Creamy Caesar Dressing|0.2
3471|11857|1100|Squash, summer, all varieties, cooked, boiled, drained, with salt|0.2
4302|14242|1400|Cranberry juice cocktail, bottled|0.2
3124|11401|1100|Potatoes, frozen, whole, cooked, boiled, drained, without salt|0.2
4321|14264|1400|Beverages, fruit punch drink, without added nutrients, canned|0.2
3472|11858|1100|Squash, summer, crookneck and straightneck, cooked, boiled, drained, with salt|0.2
3459|11845|1100|Pumpkin, cooked, boiled, drained, with salt|0.2
4187|14091|1400|Beverages, almond milk, unsweetened, shelf stable|0.2
2464|9515|900|Fruit juice smoothie, BOLTHOUSE FARMS, GREEN GOODNESS|0.2
3254|11585|1100|Vegetable juice cocktail, low sodium, canned|0.2
4188|14092|1400|Beverages, chocolate almond milk, unsweetened, shelf-stable, fortified with vitamin D2 and E|0.2
4320|14263|1400|Beverages, citrus fruit juice drink, frozen concentrate, prepared with water|0.1
4477|14647|1400|Beverages, Fruit flavored drink, reduced sugar, greater than 3% fruit juice, high vitamin C, added calcium|0.1
4294|14234|1400|Beverages, OCEAN SPRAY, Cran Lemonade|0.1
4137|14025|1400|Alcoholic beverage, whiskey sour, prepared with water, whiskey and powder mix|0.1
2166|9052|900|Blueberries, canned, heavy syrup, solids and liquids|0.1
2168|9054|900|Blueberries, frozen, unsweetened|0.1
2222|9112|900|Grapefruit, raw, pink and red, all areas (Citrus paradisi)|0.1
2165|9050|900|Blueberries, raw (Vaccinium spp.)|0.1
2962|11210|1100|Eggplant, cooked, boiled, drained, without salt|0.1
436|3174|300|Babyfood, juice, orange and apple and banana|0.1
4139|14027|1400|Alcoholic beverage, whiskey sour, canned|0.1
437|3175|300|Babyfood, juice, orange and apricot|0.1
2190|9078|900|Cranberries, raw (Vaccinium macrocarpon)|0.1
